#,,,,,,,,,,,,,
USGS,3446000,"MILLS RIVER NEAR MILLS RIVER, NC",ST,35.39805556,-82.595,S,NAD83,37,6010105,,11/6/1956,3/5/1979,37
USGS,3447687,"FRENCH BROAD RIVER NEAR FLETCHER, NC",ST,35.42916667,-82.5525,S,NAD83,37,6010105,,--,--,0
USGS,3447890,FRENCH BROAD R AT BLUE RIDGE PKWY AT BENT CREEK NC,ST,35.4997222,-82.5927778,S,NAD83,37,6010105,,--,--,0
USGS,3448050,"FRENCH BROAD RIVER BELOW I-26 NEAR BENT CREEK, NC",ST,35.5122222,-82.5772222,S,NAD83,37,6010105,,--,--,0
USGS,344878100,"HOMINY CREEK NR WEST ASHEVILLE, NC",ST,35.56138889,-82.5969444,S,NAD83,37,6010105,,--,--,0
USGS,3451200,"FRENCH BROAD RIVER AT HAYWOOD RD AT ASHEVILLE, NC",ST,35.585,-82.5686111,S,NAD83,37,6010105,,--,--,0
USGS,3451500,"FRENCH BROAD RIVER AT ASHEVILLE, NC",ST,35.60888889,-82.5780556,S,NAD83,37,6010105,,10/17/1956,9/9/2004,135
USGS,3456991,"PIGEON RIVER NEAR CANTON, NC",ST,35.52194444,-82.8480556,S,NAD83,37,6010106,,--,--,0
USGS,3460000,"CATALOOCHEE CREEK NEAR CATALOOCHEE, NC",ST,35.6672222,-83.0727778,S,NAD83,37,6010106,,10/18/1962,9/14/2011,461
USGS,3460795,"PIGEON R BL POWER PLANT NR WATERVILLE, NC",ST,35.7836111,-83.1119444,S,NAD83,37,6010106,,9/9/2004,9/9/2004,1
USGS,3490000,"N F HOLSTON RIVER NEAR GATE CITY, VA",ST,36.60871119,-82.567931,U,NAD83,51,6010101,19901213,10/9/1945,2/20/1976,93
USGS,3497300,"LITTLE RIVER ABOVE TOWNSEND, TN",ST,35.66453328,-83.7112821,U,NAD83,47,6010201,,8/10/1963,6/17/2019,558
USGS,3512000,"OCONALUFTEE RIVER AT BIRDTOWN, NC",ST,35.46138889,-83.3536111,S,NAD83,37,6010203,,11/6/1956,5/30/2019,76
USGS,351706800,"CHEOAH RIVER NR BEARPEN GAP NR TAPOCO, NC",ST,35.4383333,-83.91888889,S,NAD83,37,6010204,,8/10/2014,8/18/2014,3
USGS,3524000,"CLINCH RIVER AT CLEVELAND, VA",ST,36.9448295,-82.1548569,U,NAD83,51,6010205,19901213,9/11/1930,8/24/2011,77
USGS,3524500,"GUEST RIVER AT COEBURN, VA",ST,36.92926938,-82.4562619,U,NAD83,51,6010205,19901213,1/5/1950,12/15/2011,65
USGS,3524740,"CLINCH RIVER AT ROUTE 65 AT DUNGANNON, VA",ST,36.83138889,-82.4619444,S,NAD83,51,6010205,,4/27/2009,12/15/2011,27
USGS,3527220,"CLINCH RIVER NEAR LOONEYS GAP, TN",ST,36.57280708,-82.938754,U,NAD83,47,6010205,,6/17/1989,10/13/2016,186
USGS,3527620,"CLINCH RIVER AT KYLES FORD, TENN",ST,36.56953558,-83.0412794,U,NAD83,47,6010205,,11/17/1972,10/13/2016,31
USGS,3538830,"OBED RIVER AT ADAMS BRIDGE NEAR CROSSVILLE, TN",ST,36.06166667,-84.96138889,S,NAD83,47,6010208,,4/14/1999,9/27/1999,6
USGS,3539600,"DADDYS CREEK NEAR HEBBERTSBURG, TN",ST,35.99766528,-84.8224946,U,NAD83,47,6010208,,5/22/1965,6/18/2007,41
USGS,3539778,"CLEAR CREEK AT LILLY BRIDGE NEAR LANCING, TN",ST,36.1031293,-84.7182771,H,NAD83,47,6010208,,3/13/1997,10/12/2015,118
USGS,3544970,"HIWASSEE RIVER AT RIVERSIDE DR, NR HIAWASSEE, GA",ST,34.88398179,-83.7215618,S,NAD83,13,6020002,20070727,--,--,0
USGS,3556590,HIWASSEE RIVER ABOVE RELIANCE,LA-SR,35.1883333,-84.5025,S,NAD83,47,,,--,--,0
USGS,3582000,"ELK RIVER ABOVE FAYETTEVILLE, TENN.",ST,35.1345274,-86.5397166,U,NAD83,47,6030003,,11/12/1973,11/17/1981,60
USGS,3604000,"BUFFALO RIVER NEAR FLAT WOODS, TN",ST,35.49590598,-87.8328037,S,NAD83,47,6040004,,4/26/1963,8/25/2005,296
USGS,3612600,"OHIO RIVER AT OLMSTED, IL",ST,37.17921867,-89.058404,U,NAD83,17,5140206,,7/9/2014,6/26/2019,127
USGS,4001000,"WASHINGTON CREEK AT WINDIGO, MI",ST,47.9212792,-89.1459197,M,NAD83,26,4020300,,8/6/1962,5/21/2019,262
USGS,4015330,"KNIFE RIVER NEAR TWO HARBORS, MN",ST,46.94688005,-91.7924013,S,NAD83,27,4010102,,9/25/1974,10/10/2018,256
USGS,4024000,"ST. LOUIS RIVER AT SCANLON, MN",ST,46.7032765,-92.4188018,S,NAD83,27,4010201,,9/18/1955,6/4/2019,559
USGS,4026561,"TYLER FORKS RIVER AT STRICKER ROAD NEAR MELLEN, WI",ST,46.3947222,-90.59,S,NAD83,55,4010302,,8/30/2011,8/9/2016,17
USGS,4027000,"BAD RIVER NEAR ODANAH, WI",ST,46.4866144,-90.696297,S,NAD83,55,4010302,,10/12/1964,7/1/2019,607
USGS,4035995,"LAKE GOGEBIC NEAR BERGLAND, MI",LK,46.5885582,-89.547931,M,NAD83,26,4020102,,--,--,0
USGS,4040000,"ONTONAGON RIVER NEAR ROCKLAND, MI",ST,46.7207742,-89.207086,M,NAD83,26,4020102,,10/3/1974,6/18/2019,375
USGS,4041500,"STURGEON RIVER NEAR ALSTON, MI",ST,46.7258333,-88.6624167,1,NAD83,26,4020104,,--,--,0
USGS,4043097,"FALLS RIVER NEAR L'ANSE, MI",ST,46.7346552,-88.4431868,S,NAD83,26,4020105,,--,--,0
USGS,4043238,"SALMON TROUT RIVER NEAR BIG BAY, MI",ST,46.78214818,-87.8776299,S,NAD83,26,4020105,,5/14/2009,10/18/2016,19
USGS,4043244,"EAST BRANCH SALMON TROUT RIVER NEAR DODGE CITY, MI",ST,46.7857589,-87.8523522,S,NAD83,26,4020105,,5/14/2009,5/14/2009,1
USGS,4044755,"MINERS RIVER NR MUNISING, MI",ST,46.48772616,-86.5407188,M,NAD83,26,4020201,,8/27/1979,6/19/2019,20
USGS,4057801,"M BR ESCANABA R AT US HWY 41 NR HUMBOLDT, MI",ST,46.49326948,-87.8679127,S,NAD83,26,4030110,,5/19/2016,9/13/2017,8
USGS,4059000,"ESCANABA RIVER AT CORNELL, MI",ST,45.90891667,-87.2135278,1,NAD83,26,4030110,,12/17/1968,8/16/2011,306
USGS,4059500,"FORD RIVER NEAR HYDE, MI",ST,45.7549674,-87.2020793,S,NAD83,26,4030109,,12/17/1968,6/17/2019,422
USGS,4063700,"POPPLE RIVER NEAR FENCE, WI",ST,45.7636111,-88.4636111,S,NAD83,55,4030108,,10/25/1963,6/17/2019,1435
USGS,4067500,"MENOMINEE RIVER NEAR MC ALLISTER, WI",ST,45.3258333,-87.6633333,S,NAD83,55,4030108,,12/7/1977,6/6/2019,388
USGS,4067958,"PESHTIGO RIVER NEAR WABENO, WI",ST,45.38774406,-88.3051099,S,NAD83,55,4030105,,8/21/2014,9/6/2016,24
USGS,4069500,"PESHTIGO RIVER AT PESHTIGO, WI",ST,45.0475,-87.7444444,S,NAD83,55,4030105,,10/8/1933,8/9/2011,107
USGS,4071000,"OCONTO RIVER NEAR GILLETT, WI",ST,44.865,-88.3,S,NAD83,55,4030104,,11/1/1966,10/13/2003,193
USGS,4071765,"OCONTO RIVER NEAR OCONTO, WI",ST,44.86055556,-87.98388889,S,NAD83,55,4030104,,6/3/1960,8/9/2011,26
USGS,4073466,"SILVER CREEK AT SPAULDING ROAD NEAR GREEN LAKE, WI",ST,43.8397222,-88.9083333,S,NAD83,55,4030201,,12/20/2005,5/29/2019,634
USGS,4073500,"FOX RIVER AT BERLIN, WI",ST,43.95388889,-88.9525,S,NAD83,55,4030201,,5/10/1965,8/10/2011,222
USGS,4077630,"RED RIVER AT MORGAN ROAD NEAR MORGAN, WI",ST,44.8980311,-88.8442729,S,NAD83,55,4030202,,11/4/1992,9/19/2006,389
USGS,4079000,"WOLF RIVER AT NEW LONDON, WI",ST,44.3922026,-88.7403812,S,NAD83,55,4030202,,3/12/1973,8/10/2011,144
USGS,4080798,"TOMORROW RIVER NEAR NELSONVILLE, WI",ST,44.5244444,-89.3377778,S,NAD83,55,4030202,,8/24/1992,8/15/2017,85
USGS,4081000,"WAUPACA RIVER NEAR WAUPACA, WI",ST,44.32916667,-88.9958333,S,NAD83,55,4030202,,11/3/1964,8/1/2017,62
USGS,4083515,"HAWTHORNE DR STORM SEWER AT FOND DU LAC, WI",FA-STS,43.7522222,-88.4366667,S,NAD83,55,4030203,,9/25/2018,11/5/2018,6
USGS,4084445,"FOX RIVER AT APPLETON, WI",ST,44.24805556,-88.4230556,S,NAD83,55,4030204,,7/2/1986,7/22/2011,2651
USGS,4084927,"WEST PLUM CREEK AT NEW ROAD NEAR WRIGHTSTOWN, WI",ST,44.29925,-88.1918333,5,NAD83,55,4030204,,11/20/2013,9/27/2018,489
USGS,4085108,"EAST RIVER @ CNTY TRUNK HIGHWAY ZZ NR GREENLEAF,WI",ST,44.37194444,-88.0922222,S,NAD83,55,4030204,,4/21/1994,5/19/2019,761
USGS,40851385,"FOX RIVER AT OIL TANK DEPOT AT GREEN BAY, WI",ST,44.5286111,-88.01,S,NAD83,55,4030204,,11/3/1993,6/6/2019,766
USGS,4085200,"KEWAUNEE RIVER NEAR KEWAUNEE, WI",ST,44.45833125,-87.5564746,S,NAD83,55,4030102,,6/4/1960,10/15/2002,323
USGS,4085427,"MANITOWOC RIVER AT MANITOWOC, WI",ST,44.10616667,-87.7160278,S,NAD83,55,4030101,,11/30/1972,6/5/2019,561
USGS,4087119,"HONEY CREEK AT WAUWATOSA, WI",ST,43.0438333,-88.0051111,1,NAD83,55,4040003,,4/4/1973,9/6/2016,475
USGS,40871473,"WILSON PARK CREEK AT GMIA INFALL AT MILWAUKEE, WI",ST,42.945,-87.8861111,S,NAD83,55,4040003,,11/6/1996,6/3/2019,249
USGS,40871475,"WILSON PARK CREEK @ GMIA OUTFALL #7 @ MILWAUKEE,WI",ST,42.95666667,-87.9069444,S,NAD83,55,4040003,,11/6/1996,6/3/2019,1508
USGS,40871476,HOLMES AVE CRK TRIB @ GMIA OUTFALL #1 AT MILWAUKEE,ST,42.94444444,-87.9102778,S,NAD83,55,4040003,,11/6/1996,5/24/2019,338
USGS,40871488,"WILSON PARK CK @ ST. LUKES HOSPITAL @ MILWAUKEE,WI",ST,42.9897222,-87.9519444,S,NAD83,55,4040003,,11/6/1996,7/2/2019,355
USGS,4087170,"MILWAUKEE RIVER AT MOUTH AT MILWAUKEE, WI",ST,43.02444444,-87.8983333,S,NAD83,55,4040003,,10/7/1970,7/1/2019,877
USGS,4092750,"INDIANA HARBOR CANAL AT EAST CHICAGO, IN",ST-CA,41.6492023,-87.4686529,S,NAD83,18,4040001,,5/7/1996,6/6/2019,2280
USGS,4093100,"DEEP RIVER NEAR LIVERPOOL, IN",ST,41.56555556,-87.2944444,S,NAD83,18,4040001,20110801,--,--,0
USGS,4093176,"LITTLE CALUMET RIVER AT GRANT ST AT GARY, IN",ST,41.56610556,-87.3558333,1,NAD83,18,4040001,,--,--,0
USGS,4093250,"LITTLE CALUMET RIVER NEAR LAKE STATION, IN",ST,41.5725,-87.2994444,S,NAD83,18,4040001,20110801,--,--,0
USGS,4094000,"LITTLE CALUMET RIVER AT PORTER, IN",ST,41.62170456,-87.0869777,S,NAD83,18,4040001,,8/2/1973,12/9/2009,41
USGS,4095090,"PORTAGE-BURNS WATERWAY AT PORTAGE, IN",ST-DCH,41.62225939,-87.1758685,S,NAD83,18,4040001,19950601,10/6/2010,7/10/2018,97
USGS,4095300,"TRAIL CREEK AT MICHIGAN CITY, IN",ST,41.7167066,-86.85975109,S,NAD83,18,4040001,20061117,10/26/1977,8/16/1994,101
USGS,4101500,"ST. JOSEPH RIVER AT NILES, MI",ST,41.8292138,-86.2597325,M,NAD83,26,4050001,19790212,2/12/1979,6/4/2019,348
USGS,4108660,"KALAMAZOO RIVER AT NEW RICHMOND, MI",ST,42.65085976,-86.106703,M,NAD83,26,4050003,,4/12/1994,6/6/2019,907
USGS,4119400,"GRAND RIVER NEAR EASTMANVILLE, MI",ST,43.0241884,-86.0264354,S,NAD83,26,4050006,,3/30/1999,6/5/2019,351
USGS,4121650,"MUSKEGON RIVER AT BIG RAPIDS, MI",ST,43.693634,-85.4675442,S,NAD83,26,4060102,,5/23/2000,5/23/2000,1
USGS,4121660,"MUSKEGON RIVER NEAR STANWOOD, MI",ST,43.61308,-85.4778209,T,NAD83,26,4060102,,--,--,0
USGS,4121680,"MUSKEGON RIVER NEAR OXBOW, MI",ST,43.485857,-85.63060189,T,NAD83,26,4060102,,--,--,0
USGS,4121944,"LITTLE MUSKEGON RIVER NEAR OAK GROVE, MI",ST,43.43085818,-85.5955989,M,NAD83,26,4060102,,--,--,0
USGS,4121970,"MUSKEGON RIVER NEAR CROTON, MI",ST,43.43474558,-85.6653239,F,NAD83,26,4060102,,9/14/2010,9/11/2013,84
USGS,4124000,"MANISTEE RIVER NEAR SHERMAN, MI",ST,44.43639239,-85.6986792,M,NAD83,26,4060103,,10/6/1965,2/18/1971,31
USGS,4124200,"MANISTEE RIVER NEAR MESICK, MI",ST,44.3630596,-85.820905,S,NAD83,26,4060103,,--,--,0
USGS,4125460,"PINE RIVER AT HIGH SCHOOL BRIDGE NR HOXEYVILLE, MI",ST,44.19334009,-85.7697863,M,NAD83,26,4060103,,--,--,0
USGS,4125550,"MANISTEE RIVER NEAR WELLSTON, MI",ST,44.25944997,-85.94174209,S,NAD83,26,4060103,,--,--,0
USGS,4136000,"AU SABLE RIVER NEAR RED OAK, MI",ST,44.6769593,-84.2925146,M,NAD83,26,4070007,,--,--,0
USGS,4136500,"AU SABLE RIVER AT MIO, MI",ST,44.66001385,-84.1311167,M,NAD83,26,4070007,,7/13/1960,8/2/1967,4
USGS,4136900,"AU SABLE RIVER NEAR MC KINLEY, MI",ST,44.61279117,-83.83776619,S,NAD83,26,4070007,,--,--,0
USGS,4137005,"AU SABLE RIVER NEAR CURTISVILLE, MI",ST,44.56084749,-83.802764,M,NAD83,26,4070007,,--,--,0
USGS,4137020,"AU SABLE RIVER NEAR SOUTH BRANCH, MI",ST,44.46334886,-83.7213714,S,NAD83,26,4070007,,--,--,0
USGS,4137025,"AU SABLE RIVER NEAR GLENNIE, MI",ST,44.4541823,-83.6744254,T,NAD83,26,4070007,,--,--,0
USGS,4137030,"AU SABLE RIVER NEAR SIDTOWN, MI",ST,44.47279328,-83.57108839,T,NAD83,26,4070007,,--,--,0
USGS,4137500,"AU SABLE RIVER NEAR AU SABLE, MI",ST,44.43640447,-83.4338609,S,NAD83,26,4070007,,1/12/1978,11/6/2013,511
USGS,4142000,"RIFLE RIVER NEAR STERLING, MI",ST,44.0725203,-84.0199939,M,NAD83,26,4080101,,7/13/1960,6/19/2019,461
USGS,4157005,"SAGINAW RIVER AT HOLLAND AVENUE AT SAGINAW, MI",ST,43.4219699,-83.951918,S,NAD83,26,4080206,,11/29/2011,6/18/2019,217
USGS,4165500,"CLINTON RIVER AT MORAVIAN DRIVE AT MT. CLEMENS, MI",ST,42.5958674,-82.90881,M,NAD83,26,4090003,,11/16/1951,6/11/2019,590
USGS,4166500,"RIVER ROUGE AT DETROIT, MI",ST,42.3730923,-83.2546513,S,NAD83,26,4090004,,7/19/1960,6/11/2019,353
USGS,4176500,"RIVER RAISIN NEAR MONROE, MI",ST,41.9606008,-83.53104619,M,NAD83,26,4100002,,4/3/1967,6/12/2019,481
USGS,4182755,"JUNK DITCH AT FORT WAYNE, IN",ST-DCH,41.06027778,-85.1852778,5,NAD83,18,4100004,20120619,--,--,0
USGS,4183038,"BLACK CREEK NEAR HARLAN, IN",ST,41.1830833,-84.8696944,1,NAD83,18,4100005,20150818,10/21/2015,6/21/2019,609
USGS,4183500,Maumee River at Antwerp OH,ST,41.19893889,-84.7444033,S,NAD83,39,4100005,,4/5/1952,7/2/2019,706
USGS,4185000,Tiffin River at Stryker OH,ST,41.50449567,-84.4296719,S,NAD83,39,4100006,,4/5/1952,11/6/2002,95
USGS,4188496,Eagle Creek above Findlay OH,ST,40.9792203,-83.6532653,5,NAD83,39,4100008,20070810,8/14/2012,6/3/2019,1127
USGS,4189000,Blanchard River near Findlay OH,ST,41.05588646,-83.6879889,S,NAD83,39,4100008,,11/20/1962,6/13/1977,219
USGS,4193490,Maumee River near Waterville OH,ST,41.47616368,-83.7388261,S,NAD83,39,4100009,,10/27/1967,4/3/2019,207
USGS,4198000,Sandusky River near Fremont OH,ST,41.3078307,-83.1588088,S,NAD83,39,4100011,,10/11/1962,11/24/2014,5255
USGS,4199000,Huron River at Milan OH,ST,41.3008852,-82.6082326,S,NAD83,39,4100012,,9/23/1964,6/21/2019,1825
USGS,4199500,Vermilion River near Vermilion OH,ST,41.38199,-82.3168273,S,NAD83,39,4100012,,9/22/1964,5/1/2019,407
USGS,4200500,Black River at Elyria OH,ST,41.38032368,-82.10459279,S,NAD83,39,4110001,,10/14/1962,4/4/2019,580
USGS,4201500,Rocky River near Berea OH,ST,41.4075483,-81.88263759,S,NAD83,39,4110001,,9/22/1964,7/5/2017,106
USGS,4202000,Cuyahoga River at Hiram Rapids OH,ST,41.3406103,-81.1667664,S,NAD83,39,4110002,,9/28/1965,8/1/2011,47
USGS,4206425,Cuyahoga River at Jaite OH,ST,41.28894396,-81.56511929,S,NAD83,39,4110002,,9/14/1982,10/23/2018,808
USGS,4208000,Cuyahoga River at Independence OH,ST,41.39533087,-81.6298478,S,NAD83,39,4110002,190309,1/22/1957,4/3/2019,6360
USGS,4212100,Grand River near Painesville OH,ST,41.7189339,-81.2278789,S,NAD83,39,4110004,,11/17/1977,6/18/2019,1352
USGS,4213000,Conneaut Creek at Conneaut OH,ST,41.92699898,-80.6039659,S,NAD83,39,4120101,,9/21/1964,11/28/1979,119
USGS,4213152,"Walnut Creek Upstream Pool, near Erie, PA",ST,42.07388889,-80.2347222,S,NAD83,42,4120101,20080401,5/30/2013,11/14/2018,118
USGS,4213500,CATTARAUGUS CREEK AT GOWANDA NY,ST,42.4633333,-78.9341667,S,NAD83,36,4120102,,8/13/1956,6/11/2019,878
USGS,422026250,NORTHRUP CREEK AT NORTH GREECE NY,ST,43.2536111,-77.7422222,S,NAD83,36,4130001,,9/29/1989,5/10/2019,1167
USGS,4226000,KESHEQUA CR AT CRAIG COLONY AT SONYEA NY,ST,42.6824722,-77.8286944,1,NAD83,36,4130002,,4/8/1954,5/13/2019,552
USGS,4231600,"GENESEE RIVER AT FORD STREET BRIDGE, ROCHESTER NY",ST,43.1417222,-77.6163056,1,NAD83,36,4130003,,10/28/2010,6/21/2019,229
USGS,4232050,ALLEN CREEK NEAR ROCHESTER NY,ST,43.12802778,-77.527,1,NAD83,36,4140101,,3/16/1971,6/6/2017,1882
USGS,423205010,IRONDEQUOIT CR ABOVE BLOSSOM RD NEAR ROCHESTER NY,ST,43.145,-77.5119444,S,NAD83,36,4140101,,8/30/1980,5/10/2019,4058
USGS,4236000,SKANEATELES LAKE AT SKANEATELES NY,LK,42.94476667,-76.4291917,H,NAD83,36,4140201,,11/3/1960,12/14/2018,5
USGS,4249000,"OSWEGO RIVER AT LOCK 7, OSWEGO NY",ST,43.45166667,-76.50527778,S,NAD83,36,4140203,,8/28/1957,5/29/2019,897
USGS,4253296,BUCK CREEK NEAR INLET NY,ST,43.7439541,-74.7218348,S,NAD83,36,4150101,19881104,4/12/1982,3/19/2019,2192
USGS,4256000,INDEPENDENCE RIVER AT DONNATTSBURG NY,ST,43.74680556,-75.3334444,1,NAD83,36,4150101,,1/20/1960,4/21/1972,9
USGS,4282576,"OTTER CREEK BLW VERGENNES FALLS, AT VERGENNES, VT",ST,44.16956667,-73.25848889,5,NAD83,50,4150402,,--,--,0
USGS,4294413,LAKE CHAMPLAIN AT PORT HENRY NY,LK,44.05275,-73.4535,1,NAD83,36,4150408,,--,--,0
USGS,4294500,"LAKE CHAMPLAIN AT BURLINGTON, VT",LK,44.47616017,-73.2215166,S,NAD83,50,4150403,,10/15/1970,8/3/1979,18
USGS,4295000,RICHELIEU R (LAKE CHAMPLAIN) AT ROUSES POINT NY,LK,44.99615019,-73.3598555,S,NAD83,36,4150409,,8/16/1966,8/8/1995,506
USGS,5014300,Swiftcurrent Cr ab Swiftcurrent Lk at Many Glacier,ST,48.7954444,-113.6805833,1,NAD83,30,9040001,,3/12/2001,6/25/2019,479
USGS,5054000,"RED RIVER OF THE NORTH AT FARGO, ND",ST,46.861075,-96.7836924,F,NAD83,38,9020104,,5/16/1949,6/11/2019,1045
USGS,5055300,"SHEYENNE R AB DEVILS LK STATE OUTLET NR FLORA, ND",ST,47.90777778,-99.4155556,S,NAD83,38,9020202,,7/20/2005,8/21/2007,17
USGS,5055400,"SHEYENNE R BL DEVILS LK STATE OUTLET NR BREMEN, ND",ST,47.82138889,-99.2761111,S,NAD83,38,9020202,,7/20/2005,7/1/2010,30
USGS,5056678,"TOLNA COULEE NEAR TOLNA, ND",ST,47.8608333,-98.4944444,S,NAD83,38,9020203,,--,--,0
USGS,5057000,"SHEYENNE RIVER NR COOPERSTOWN, ND",ST,47.43277097,-98.0275954,F,NAD83,38,9020203,,10/11/1959,8/8/2012,666
USGS,5058000,"SHEYENNE RIVER BELOW BALDHILL DAM, ND",ST,47.0338718,-98.0837077,R,NAD83,38,9020204,,6/5/1959,8/8/2012,435
USGS,5059300,"SHEYENNE R AB SHEYENNE R DIVERSION NR HORACE, ND",ST,46.74638889,-96.9269444,F,NAD83,38,9020204,,10/7/1992,8/26/2013,370
USGS,5064500,"RED RIVER OF THE NORTH AT HALSTAD, MN",ST,47.351918,-96.843691,S,NAD83,38,9020107,,7/8/1961,6/12/2019,686
USGS,5082500,"RED RIVER OF THE NORTH AT GRAND FORKS, ND",ST,47.9269234,-97.0292435,R,NAD83,38,9020301,,6/22/1949,6/18/2019,1171
USGS,5114000,"SOURIS RIVER NR SHERWOOD, ND",ST,48.9900156,-101.9582209,F,NAD83,38,9010008,,9/12/1970,6/4/2019,597
USGS,5117500,"SOURIS RIVER ABOVE MINOT, ND",ST,48.2458428,-101.3712745,F,NAD83,38,9010008,,9/15/1969,6/5/2019,474
USGS,5124000,"SOURIS RIVER NR WESTHOPE, ND",ST,48.9964079,-100.9584889,F,NAD83,38,9010003,,8/12/1954,9/5/2018,1049
USGS,5124480,"KAWISHIWI RIVER NEAR ELY, MN",ST,47.9226749,-91.535126,S,NAD83,27,9030001,,7/21/1966,6/28/2019,464
USGS,5133500,"RAINY RIVER AT MANITOU RAPIDS, MN",ST,48.6344009,-93.913228,U,NAD83,27,9030004,,4/29/1968,8/16/1994,173
USGS,5288580,"RICE CREEK BLW OLD HWY. 8 IN MOUNDS VIEW, MN",ST,45.0933333,-93.195,S,NAD83,27,7010206,20051122,3/23/2010,4/18/2019,181
USGS,5288705,"SHINGLE CREEK AT QUEEN AVE IN MINNEAPOLIS, MN",ST,45.04996508,-93.3102274,S,NAD83,27,7010206,,3/13/1996,6/24/2019,451
USGS,5289800,"MINNEHAHA CREEK AT HIAWATHA AVE. IN MINNEAPOLIS,MN",ST,44.91552097,-93.2127224,S,NAD83,27,7010206,20051011,6/21/2013,7/1/2019,36
USGS,5331833,"NAMEKAGON RIVER AT LEONARDS, WI",ST,46.1713409,-91.32935,S,NAD83,55,7030002,,7/19/1995,10/14/2002,39
USGS,5333500,"ST. CROIX RIVER NEAR DANBURY, WI",ST,46.0761111,-92.2466667,S,NAD83,55,7030001,,10/9/1964,10/16/2003,232
USGS,5340500,"ST. CROIX RIVER AT ST. CROIX FALLS, WI",ST,45.4069444,-92.6469444,S,NAD83,55,7030005,,11/6/1966,10/16/2003,350
USGS,5357205,"ALLEQUASH CREEK NEAR SAYNER, WI",ST,46.0308444,-89.5993944,1,NAD83,55,7050002,20181016,--,--,0
USGS,5357206,"ALLEQUASH CREEK SITE NO. 3 NR BOULDER JUNCTION, WI",ST,46.03277778,-89.6077778,S,NAD83,55,7050002,,10/22/1991,6/26/2017,249
USGS,5357215,"ALLEQUASH CREEK @ CT HWY M NR BOULDER JUNCTION, WI",ST,46.02388889,-89.6527778,S,NAD83,55,7050002,,7/24/1991,6/26/2017,226
USGS,5357225,"STEVENSON CREEK @ CT HWY M NR BOULDER JUNCTION, WI",ST,46.06138889,-89.6472222,S,NAD83,55,7050002,,8/21/1975,6/26/2017,226
USGS,5357230,"NORTH CREEK AT TROUT LAKE NEAR BOULDER JUNCTION,WI",ST,46.0786111,-89.6672222,S,NAD83,55,7050002,,1/3/1991,6/26/2017,300
USGS,5357245,"TROUT RIVER AT TROUT LAKE NEAR BOULDER JUNCTION,WI",ST,46.03555556,-89.7055556,S,NAD83,55,7050002,,7/24/1991,6/26/2017,179
USGS,53674967,"TROUT CREEK AT TENTH STREET NEAR BLOOMER, WI",ST,45.0994444,-91.6511111,S,NAD83,55,7050007,20120813,--,--,0
USGS,5370000,"EAU GALLE RIVER AT SPRING VALLEY, WI",ST,44.85277778,-92.2383333,S,NAD83,55,7050005,,3/28/1967,9/7/1993,49
USGS,5382255,"STILLWELL CREEK AT SIXTEENTH COURT NEAR TOMAH, WI",ST,43.99388889,-90.6572222,S,NAD83,55,7040006,20080918,12/2/2008,8/19/2015,316
USGS,5382257,"STILLWELL CREEK AT YARD ROAD NEAR TOMAH, WI",ST,44.00055556,-90.6811111,S,NAD83,55,7040006,20080918,11/10/2008,9/26/2018,983
USGS,5382267,"LA CROSSE RIVER @ CNTY TRUNK HIGHWY BB NR TOMAH,WI",ST,44.00027778,-90.7244444,S,NAD83,55,7040006,20080918,1/29/2008,9/25/2018,896
USGS,5382284,"SILVER CREEK AT STATE HIGHWAY 21 NEAR ANGELO, WI",ST,43.9672222,-90.765,S,NAD83,55,7040006,20090724,9/27/2012,9/25/2018,600
USGS,5406457,"BLACK EARTH CREEK NR BREWERY RD AT CROSS PLAINS,WI",ST,43.1097222,-89.6408333,S,NAD83,55,7070005,20090928,10/23/2009,6/17/2019,491
USGS,5406469,"BREWERY CREEK-UPSTREAM SITE-AT CROSS PLAINS, WI",ST,43.12527778,-89.635,S,NAD83,55,7070005,19990727,7/17/1999,6/17/2019,689
USGS,5406479,"BLACK EARTH CK NR TREATMENT PLNT @ CROSS PLAINS,WI",ST,43.1147222,-89.6641667,S,NAD83,55,7070005,20091022,10/28/2009,6/17/2019,452
USGS,5407000,"WISCONSIN RIVER AT MUSCODA, WI",ST,43.19805556,-90.4433333,S,NAD83,55,7070005,,11/13/1964,6/14/2008,317
USGS,5412500,"Turkey River at Garber, IA",ST,42.7399884,-91.261799,F,NAD83,19,7060004,19130829,2/24/1958,5/20/2019,419
USGS,5418400,"North Fork Maquoketa River near Fulton, IA",ST,42.1643333,-90.7293333,1,NAD83,19,7060006,19290417,9/24/1969,8/31/2016,125
USGS,5418720,"Maquoketa River near Green Island, IA",ST,42.1638611,-90.3350833,1,NAD83,19,7060006,19470614,3/17/2015,10/18/2017,6
USGS,5420460,"Beaver Slough at 3rd Street at Clinton, IA",ST,41.82725169,-90.1904045,F,NAD83,19,7080101,199208,10/26/1994,9/8/1999,25
USGS,5420500,"Mississippi River at Clinton, IA",ST,41.78058635,-90.252073,F,NAD83,19,7080101,187306,1/29/1953,6/24/2019,680
USGS,5427718,"YAHARA RIVER AT WINDSOR, WI",ST,43.20888889,-89.3525,S,NAD83,55,7090001,,2/10/1976,7/1/2019,4293
USGS,5427850,"YAHARA RIVER AT STATE HIGHWAY 113 AT MADISON, WI",ST,43.1508333,-89.4019444,S,NAD83,55,7090001,,2/11/2002,7/1/2019,1016
USGS,5427880,"SIXMILE CREEK AT STATE HIGHWAY 19 NEAR WAUNAKEE,WI",ST,43.1922222,-89.4728889,5,NAD83,55,7090002,,7/2/2012,5/30/2019,626
USGS,5427910,"SIXMILE CREEK @ COUNTY TRNK HGHWY M NR WAUNAKEE,WI",ST,43.1468333,-89.4368333,5,NAD83,55,7090002,,7/23/2012,5/29/2019,632
USGS,5427927,"DORN (SPRING) CREEK @ CT HIGHWAY Q NR WAUNAKEE, WI",ST,43.14505556,-89.4718611,5,NAD83,55,7090002,,7/2/2012,5/26/2019,718
USGS,5427930,"DORN (SPRING) CREEK AT CT HIGHWAY M NR WAUNAKEE,WI",ST,43.14027778,-89.4423056,5,NAD83,55,7090002,,2/17/1976,5/26/2019,655
USGS,5427943,"PHEASANT BRANCH AT AIRPORT ROAD NEAR MIDDLETON, WI",ST,43.1111111,-89.5361111,S,NAD83,55,7090001,,6/7/1977,7/1/2019,1089
USGS,54279465,"S FORK PHEASANT BRANCH @ DEMING WAY @ MIDDLETON,WI",ST,43.09860617,-89.52151,S,NAD83,55,7090001,20080303,3/13/2008,7/1/2019,812
USGS,5427948,"PHEASANT BRANCH AT MIDDLETON, WI",ST,43.1033333,-89.5116667,S,NAD83,55,7090001,,7/2/1974,6/28/2019,5227
USGS,5427965,"SPRING HARBOR STORM SEWER AT MADISON, WI",FA-STS,43.07916667,-89.4708333,S,NAD83,55,7090001,,3/11/1976,7/1/2019,5743
USGS,5429000,"LAKE MONONA AT MADISON, WI",LK,43.0633297,-89.3970636,S,NAD83,55,7090001,,5/8/1992,9/1/1993,8
USGS,5435943,"BADGER MILL CREEK AT VERONA, WI",ST,42.97694444,-89.5394444,S,NAD83,55,7090004,,6/20/2019,6/20/2019,1
USGS,5435950,"SUGAR RIVER NEAR VERONA, WI",ST,42.94916667,-89.5441667,S,NAD83,55,7090004,,--,--,0
USGS,5440700,"ROCK RIVER AT BYRON, IL",ST,42.1230805,-89.2559395,S,NAD83,17,7090005,20000509,10/6/1977,6/26/2019,296
USGS,5446500,"ROCK RIVER NEAR JOSLIN, IL",ST,41.5561111,-90.1852778,S,NAD83,17,7090005,,10/3/1966,6/25/2019,888
USGS,5447500,"GREEN RIVER NEAR GENESEO, IL",ST,41.48892309,-90.1576186,S,NAD83,17,7090007,19971001,10/3/1966,6/25/2019,559
USGS,5455100,"Old Mans Creek near Iowa City, IA",ST,41.60640518,-91.61572419,F,NAD83,19,7080209,195010,7/8/1970,5/20/2019,519
USGS,5457000,"CEDAR RIVER NEAR AUSTIN, MN",ST,43.63718529,-92.9746369,S,NAD83,27,7080201,,8/17/1961,8/21/1984,147
USGS,5458300,"Cedar River at Waverly, IA",ST,42.73721967,-92.47009,H,NAD83,19,7080201,20000802,7/14/2000,2/20/2002,18
USGS,5464420,"Cedar River at Blairs Ferry Road at Palo, IA",ST,42.06916346,-91.7851803,F,NAD83,19,7080205,19921215,10/28/1992,6/17/2019,46
USGS,5465500,"Iowa River at Wapello, IA",ST,41.1780861,-91.1820939,F,NAD83,19,7080209,191410,5/29/1944,6/26/2019,3611
USGS,5481000,"Boone River near Webster City, IA",ST,42.43247506,-93.8057762,S,NAD83,19,7100005,194003,10/2/1968,1/9/2018,277
USGS,5482000,"Des Moines River at 2nd Avenue at Des Moines, IA",ST,41.61248906,-93.6210513,F,NAD83,19,7100004,190210,6/17/1944,8/21/2012,71
USGS,5482300,"North Raccoon River near Sac City, IA",ST,42.35475,-94.9903333,S,NAD83,19,7100006,19580603,10/2/1969,6/6/2016,279
USGS,5482500,"North Raccoon River near Jefferson, IA",ST,41.98803907,-94.3769127,F,NAD83,19,7100006,19400305,10/3/1968,6/6/2016,256
USGS,5484000,"South Raccoon River at Redfield, IA",ST,41.5894324,-94.1513463,F,NAD83,19,7100007,19400304,4/25/1945,5/1/2017,206
USGS,5484500,"Raccoon River at Van Meter, IA",ST,41.5338779,-93.9499503,F,NAD83,19,7100006,19150424,6/17/1944,6/4/2019,325
USGS,5487520,"Des Moines River near Swan, IA",ST,41.4894,-93.27825,S,NAD83,19,7100008,20061114,--,--,0
USGS,5515500,"KANKAKEE RIVER AT DAVIS, IN",ST,41.38963889,-86.7061667,1,NAD83,18,7120001,,11/20/2013,6/6/2019,66
USGS,5516665,"YELLOW RIVER NEAR OAK GROVE, IN",ST,41.27138889,-86.4666667,S,NAD83,18,7120001,20120508,5/11/2012,6/17/2019,81
USGS,5517000,"YELLOW RIVER AT KNOX, IN",ST,41.3028196,-86.6205695,S,NAD83,18,7120001,,7/1/1999,6/17/2019,124
USGS,5517010,"YELLOW RIVER NEAR BREMS, IN",ST,41.30666667,-86.7375,S,NAD83,18,7120001,20120508,5/31/2012,6/17/2019,89
USGS,5517500,"KANKAKEE RIVER AT DUNNS BRIDGE, IN",ST,41.2200392,-86.968356,S,NAD83,18,7120001,,6/30/1999,6/6/2019,49
USGS,5518000,"KANKAKEE RIVER AT SHELBY, IN",ST,41.1828134,-87.3403096,S,NAD83,18,7120001,192210,10/26/1963,6/18/2019,128
USGS,5524500,"IROQUOIS RIVER NEAR FORESMAN, IN",ST,40.87059306,-87.3066912,S,NAD83,18,7120002,194812,7/10/1968,6/19/2019,124
USGS,5527000,"KANKAKEE RIVER AT CUSTER PARK, IL",ST,41.2461111,-88.1275,S,NAD83,17,7120001,20120907,--,--,0
USGS,5527500,"KANKAKEE RIVER NEAR WILMINGTON, IL",ST,41.34669805,-88.1864487,U,NAD83,17,7120001,,1/5/1965,5/15/2019,468
USGS,5536160,"LITTLE CALUMET RIVER NEAR HAMMOND, IN",ST,41.56836897,-87.4744848,S,NAD83,18,7120003,20081106,--,--,0
USGS,5536179,"HART DITCH AT DYER, IN",ST-DCH,41.5078132,-87.51004,S,NAD83,18,7120003,,--,--,0
USGS,5536195,"LITTLE CALUMET RIVER AT MUNSTER, IN",ST,41.5775,-87.5222222,S,NAD83,18,7120003,,10/4/1977,8/20/1986,74
USGS,5536890,"CHICAGO SANITARY AND SHIP CANAL NR LEMONT, IL",ST,41.69138889,-87.9644444,S,NAD83,17,7120004,20040521,--,--,0
USGS,5536995,"CHICAGO SANITARY AND SHIP CANAL AT ROMEOVILLE, IL",ST,41.6408333,-88.0594444,S,NAD83,17,7120004,20170118,4/9/1987,2/21/2001,916
