#,,,,,,,,,,,,,
USGS,11203580,SF TULE R NR CHOLOLLO CAMPGROUND NR PORTERVILLE CA,ST,36.04828125,-118.6542556,S,NAD83,6,18030006,,1/28/2015,5/24/2016,3
USGS,11204100,SF TULE R NR RESERVATION BNDRY NR PORTERVILLE CA,ST,36.02411648,-118.8134258,S,NAD83,6,18030006,,4/10/2014,4/10/2014,1
USGS,11206820,MARBLE FORK KAWEAH R AB HORSE C NR LODGEPOLE CA,ST,36.61166667,-118.7016667,U,NAD83,6,18030007,,11/19/2012,6/17/2019,113
USGS,11251000,SAN JOAQUIN R BL FRIANT CA,ST,36.98439397,-119.7243124,F,NAD83,6,18040001,,4/14/1951,1/10/2017,176
USGS,11254000,SAN JOAQUIN R NR MENDOTA CA,ST,36.8105046,-120.3782256,S,NAD83,6,18040001,,4/13/1951,1/11/2016,543
USGS,11261100,SALT SLOUGH A HWY 165 NR STEVINSON CA,ST,37.24771864,-120.8521446,S,NAD83,6,18040001,,9/12/1984,8/24/2017,228
USGS,11261500,SAN JOAQUIN R A FREMONT FORD BRIDGE CA,ST,37.3099386,-120.9310369,S,NAD83,6,18040001,,7/1/1955,8/17/2016,368
USGS,11262900,MUD SLOUGH NR GUSTINE CA,ST,37.26244,-120.9065908,S,NAD83,6,18040001,,6/11/1985,8/24/2017,219
USGS,11264500,MERCED R A HAPPY ISLES BRIDGE NR YOSEMITE CA,ST,37.73131496,-119.5590514,S,NAD83,6,18040008,,11/20/1967,6/24/2019,983
USGS,11273400,SAN JOAQUIN R AB MERCED R NR NEWMAN CA,ST,37.3472151,-120.9761777,F,NAD83,6,18040001,,8/12/2014,10/3/2016,5
USGS,11274500,ORESTIMBA C NR NEWMAN CA,ST,37.31549247,-121.1252081,F,NAD83,6,18040002,,2/17/1993,1/10/1995,6
USGS,11274550,SAN JOAQUIN R NR CROWS LANDING CA,ST,37.43187949,-121.0138193,S,NAD83,6,18040002,,1/18/1962,10/5/2016,104
USGS,11276500,TUOLUMNE R NR HETCH HETCHY CA,ST,37.93742147,-119.7982326,F,NAD83,6,18040009,,9/23/1981,8/25/2017,8
USGS,11276600,TUOLUMNE R AB EARLY INTAKE NR MATHER CA,ST,37.87936848,-119.947126,F,NAD83,6,18040009,,10/7/2014,8/18/2017,4
USGS,11276900,TUOLUMNE R BL EARLY INTAKE NR MATHER CA,ST,37.8815908,-119.9701824,F,NAD83,6,18040009,,10/9/2014,8/17/2017,4
USGS,11277300,CHERRY C BL VALLEY DAM NR HETCH HETCHY CA,ST,37.96769944,-119.9174029,F,NAD83,6,18040009,,7/24/2014,8/18/2017,8
USGS,11278000,ELEANOR C NR HETCH HETCHY CA,ST,37.969088,-119.882124,F,NAD83,6,18040009,,8/28/2014,8/16/2017,7
USGS,11278300,CHERRY C NR EARLY INTAKE CA,ST,37.89436824,-119.962682,F,NAD83,6,18040009,,5/15/2014,8/9/2017,7
USGS,11278400,CHERRY C BL DION R HOLM PH NR MATHER CA,ST,37.8902017,-119.9699046,F,NAD83,6,18040009,,6/11/2014,8/17/2017,6
USGS,11289650,TUOLUMNE R BL LAGRANGE DAM NR LAGRANGE CA,ST,37.666321,-120.4421394,F,NAD83,6,18040009,,12/9/2014,9/13/2017,6
USGS,11290000,TUOLUMNE R A MODESTO CA,ST,37.627153,-120.9843777,1,NAD83,6,18040009,,6/24/1985,8/30/2017,159
USGS,11299997,STANISLAUS R BL TULLOCH PP NR KNIGHTS FERRY CA,ST,37.87603788,-120.6052025,F,NAD83,6,18040010,,--,--,0
USGS,11302000,STANISLAUS R BL GOODWIN DAM NR KNIGHTS FERRY CA,ST,37.85159385,-120.6379816,F,NAD83,6,18040010,,7/23/1992,9/21/2017,8
USGS,11302500,STANISLAUS R A OAKDALE CA,ST,37.77715006,-120.852988,F,NAD83,6,18040010,,12/10/2014,9/13/2017,6
USGS,11303000,STANISLAUS R A RIPON CA,ST,37.72965078,-121.1104934,S,NAD83,6,18040010,,6/24/1985,5/11/2017,151
USGS,11303500,SAN JOAQUIN R NR VERNALIS CA,ST,37.6760406,-121.2663293,S,NAD83,6,18040003,,12/2/1950,7/1/2019,7810
USGS,11304810,SAN JOAQUIN R BL GARWOOD BRIDGE A STOCKTON CA,ST,37.93547987,-121.3302245,S,NAD83,6,18040003,,3/16/2010,4/23/2019,110
USGS,11313315,OLD RIVER NEAR BYRON CA,ST,37.89103627,-121.5702283,S,NAD83,6,18040003,,3/15/2010,2/7/2019,47
USGS,11313433,DUTCH SLOUGH BL JERSEY ISLAND RD A JERSEY ISLAND,ST,38.0135326,-121.667731,S,NAD83,6,18040003,,9/17/2010,5/19/2015,30
USGS,11313460,SAN JOAQUIN R A PRISONERS PT NR TERMINOUS CA,ST,38.05944444,-121.5572222,5,NAD83,6,18040003,,3/15/2010,3/26/2019,138
USGS,11336600,DELTA CROSS CHANNEL NR WALNUT GROVE,ST,38.2447222,-121.5052778,5,NAD83,6,18040012,,10/3/1960,5/15/2015,86
USGS,11336680,S MOKELUMNE R A NEW HOPE BR NR WALNUT GROVE CA,ST,38.22555556,-121.491111,S,NAD83,6,18040012,,10/20/2011,10/18/2018,57
USGS,11336685,N MOKELUMNE NR WALNUT GROVE CA,ST,38.2233333,-121.5072222,S,NAD83,6,18040012,,10/20/2011,10/18/2018,69
USGS,11336790,LITTLE POTATO SLOUGH A TERMINOUS CA,ST,38.09638889,-121.496111,5,NAD83,6,18040012,,3/16/2010,10/18/2018,58
USGS,11337190,SAN JOAQUIN R A JERSEY POINT CA,ST,38.0521424,-121.6888428,S,NAD83,6,18040003,,9/17/2010,6/20/2019,168
USGS,11355500,HAT C NR HAT CREEK CA,ST,40.6891111,-121.4228056,S,NAD83,6,18020003,,7/14/1977,9/28/2017,7
USGS,11381500,MILL C NR LOS MOLINOS CA,ST,40.0546022,-122.0241541,F,NAD83,6,18020156,,11/5/1977,12/13/2017,193
USGS,11383500,DEER C NR VINA CA,ST,40.01404745,-121.9483181,F,NAD83,6,18020157,,10/18/1995,12/13/2017,11
USGS,11390000,BUTTE C NR CHICO CA,ST,39.72599524,-121.7088643,F,NAD83,6,18020158,,10/10/1960,12/12/2017,185
USGS,11390500,SACRAMENTO R BL WILKINS SLOUGH NR GRIMES CA,ST,39.00989476,-121.82469,F,NAD83,6,18020104,,8/13/1985,9/6/2017,8
USGS,11433790,NF AMERICAN R A AUBURN DAM SITE NR AUBURN CA,ST,38.8829546,-121.0630007,S,NAD83,6,18020128,,9/23/2014,10/30/2017,4
USGS,11446030,SF AMERICAN R NR PILOT HILL CA,ST,38.76295708,-121.0082763,S,NAD83,6,18020129,,--,--,0
USGS,11446220,AMERICAN R BL FOLSOM DAM NR FOLSOM CA,ST,38.70452778,-121.164361,S,NAD83,6,18020111,,5/7/2015,9/2/2015,2
USGS,11446500,AMERICAN R A FAIR OAKS CA,ST,38.6354601,-121.2277262,F,NAD83,6,18020111,,1/21/1951,6/23/2003,337
USGS,11446700,AMERICAN R A WILLIAM B POND PARK A CARMICHAEL CA,ST,38.59129436,-121.3327288,S,NAD83,6,18020111,,1/30/2015,8/14/2017,4
USGS,11446980,AMERICAN R BL WATT AVE BRDG NR CARMICHAEL CA,ST,38.5671281,-121.3882857,S,NAD83,6,18020111,,7/21/2014,8/14/2017,7
USGS,11447650,SACRAMENTO R A FREEPORT CA,ST,38.45601954,-121.5013437,S,NAD83,6,18020163,,11/7/1958,6/24/2019,3702
USGS,11447890,SACRAMENTO R AB DELTA CROSS CHANNEL CA,ST,38.25769218,-121.5182865,S,NAD83,6,18020163,,9/14/2010,6/11/2019,144
USGS,11447903,GEORGIANA SLOUGH NR SACRAMENTO R,ST,38.2372222,-121.5175,5,NAD83,6,18040012,,9/14/2010,5/23/2019,179
USGS,11447905,SACRAMENTO R BL GEORGIANA SLOUGH CA,ST,38.23880385,-121.5227309,S,NAD83,6,18020163,,3/16/2010,7/19/2016,34
USGS,11451800,CACHE C A RUMSEY CA,ST,38.8898988,-122.2383082,S,NAD83,6,18020116,,9/7/1980,5/1/2019,654
USGS,11452800,CACHE C OVERFLOW WEIR FROM SETTLING BAS NR WOOD'LD,ST,38.68268185,-121.6730164,S,NAD83,6,18020163,,1/11/2008,4/17/2019,443
USGS,11452900,CACHE C OUTFLOW FROM SETTLING BASIN NR WOODLAND CA,ST,38.67851526,-121.6727386,S,NAD83,6,18020163,,3/1/2000,4/29/2019,482
USGS,11453000,YOLO BYPASS NR WOODLAND CA,ST,38.6776817,-121.6441266,F,NAD83,6,18020163,,2/4/1957,2/5/2019,835
USGS,11455095,SACRAMENTO R DEEP WATER SHIP CHANNEL NR FREEPORT,ST,38.47686944,-121.5836417,S,NAD83,6,18020163,,5/30/2018,2/25/2019,12
USGS,11455136,SACRAMENTO R DEEP WATER SHIP CHANNEL NR CLARKSBURG,ST,38.40444444,-121.6145556,1,NAD83,6,18020163,,10/31/2017,2/25/2019,24
USGS,11455140,TOE DRAIN A LIBERTY ISLAND NR COURTLAND CA,ST,38.34916667,-121.6447222,5,NAD83,6,18020163,20140914,5/24/2016,7/2/2019,81
USGS,11455142,SACRAMENTO R DEEP WATER SHIP CHANNEL NR COURTLAND,ST,38.34166667,-121.6438889,S,NAD83,6,18020163,20140424,4/16/2014,7/2/2019,75
USGS,11455146,LIBERTY CUT A LITTLE HOLLAND TRACT NR COURTLAND CA,ST,38.32885,-121.6675306,S,NAD83,6,18020163,,2/5/2014,3/19/2019,160
USGS,11455165,MINER SLOUGH A HWY 84 BRIDGE,ST,38.29166667,-121.6308333,5,NAD83,6,18020163,,10/9/2008,5/21/2019,168
USGS,11455280,CACHE SLOUGH NR HASTINGS TRACT NR RIO VISTA CA,ST,38.27555556,-121.7091667,5,NAD83,6,18020163,,11/5/2008,3/19/2019,173
USGS,11455315,CACHE SLOUGH A S LIBERTY ISLAND NR RIO VISTA CA,ST,38.2422222,-121.686111,S,NAD83,6,18020163,,4/6/2012,5/29/2019,249
USGS,11455335,SACRAMENTO R DEEP WATER SHIP CHANNEL NR RIO VISTA,ST,38.2561111,-121.6666667,5,NAD83,6,18020163,,11/6/2008,5/29/2019,209
USGS,11455385,CACHE SLOUGH AB RYER ISLAND FERRY NR RIO VISTA CA,ST,38.19395556,-121.6580028,S,NAD83,6,18020163,20180529,7/2/2018,6/13/2019,97
USGS,11455420,SACRAMENTO R A RIO VISTA CA,ST,38.14904444,-121.6889444,S,NAD83,6,18020163,,10/1/1980,4/3/2019,862
USGS,11455478,SACRAMENTO R A DECKER ISLAND NR RIO VISTA CA,ST,38.093252,-121.7371772,S,NAD83,6,18020163,,3/15/2010,6/13/2019,168
USGS,11455508,SUISUN BAY A VAN SICKLE ISLAND NR PITTSBURG CA,ES,38.04953056,-121.88755,H,NAD83,6,18050001,20160912,9/14/2015,4/23/2019,45
USGS,11455780,SUISUN BAY A BENICIA BRIDGE NR BENICIA CA,ES,38.04492057,-122.1266323,S,NAD83,6,18050001,,10/11/2001,6/26/2019,408
USGS,11455820,CARQUINEZ STRAIT A CARQUINEZ BR NR CROCKETT CA,ST,38.0613095,-122.2255241,S,NAD83,6,18050002,,10/15/1998,9/4/2002,88
USGS,11458000,NAPA R NR NAPA CA,ST,38.3682457,-122.3033085,F,NAD83,6,18050002,,5/5/1970,7/13/1993,554
USGS,11458433,SONOMA CREEK A KENWOOD CA,ST,38.4188004,-122.5627606,S,NAD83,6,18050002,,2/9/2016,7/7/2017,4
USGS,11458500,SONOMA C A AGUA CALIENTE CA,ST,38.32324705,-122.4944258,S,NAD83,6,18050002,,11/19/2002,5/8/2018,18
USGS,11462500,RUSSIAN R NR HOPLAND CA,ST,39.02656314,-123.1305588,F,NAD83,6,18010110,,4/12/1951,11/1/2017,228
USGS,11463000,RUSSIAN R NR CLOVERDALE CA,ST,38.8793475,-123.0536124,F,NAD83,6,18010110,,11/15/1965,7/6/2017,99
USGS,11463682,RUSSIAN R A JIMTOWN CA,ST,38.65824247,-122.8294376,S,NAD83,6,18010110,,8/13/2015,10/28/2016,5
USGS,11463980,RUSSIAN R A DIGGER BEND NR HEALDSBURG CA,ST,38.6329653,-122.8555494,F,NAD83,6,18010110,,6/5/2007,11/6/2017,15
USGS,11465240,DRY C BLW LAMBERT BR NR GEYSERVILLE CA,ST,38.65324355,-122.9272191,S,NAD83,6,18010110,,6/10/2014,9/5/2017,4
USGS,11466800,MARK WEST C NR MIRABEL HEIGHTS CA,ST,38.49407838,-122.8533258,S,NAD83,6,18010110,,7/13/1973,5/9/2017,232
USGS,11467000,RUSSIAN R A HACIENDA BRIDGE NR GUERNEVILLE CA,ST,38.50852336,-122.9277737,F,NAD83,6,18010110,,4/13/1951,5/25/2016,2869
USGS,11468900,MATTOLE R NR ETTERSBURG CA,ST,40.139309,-123.991423,S,NAD83,6,18010107,,7/12/2001,9/26/2017,56
USGS,11475560,ELDER C NR BRANSCOMB CA,ST,39.7295997,-123.6439073,F,NAD83,6,18010106,,2/15/1968,9/20/2016,513
USGS,11501000,"SPRAGUE RIVER NEAR CHILOQUIN, OR",ST,42.58430556,-121.8483333,S,NAD83,41,18010202,,9/11/1961,7/1/2019,129
USGS,11502500,"WILLIAMSON RIVER BLW SPRAGUE RIVER NR CHILOQUIN,OR",ST,42.564375,-121.8797139,S,NAD83,41,18010201,,9/12/1961,7/1/2019,140
USGS,11504115,"WOOD RIVER NEAR KLAMATH AGENCY, OR",ST,42.58155556,-121.9417028,S,NAD83,41,18010203,20130724,11/26/2013,7/2/2019,92
USGS,11507500,"LINK RIVER AT KLAMATH FALLS, OR",ST,42.22347795,-121.7941708,U,NAD83,41,18010204,,8/14/2013,8/12/2014,7
USGS,11509370,"KLAMATH RIVER ABOVE KENO DAM, AT KENO, OR",ST,42.12792225,-121.9288964,S,NAD83,41,18010204,,3/17/1998,9/3/2015,146
USGS,11509500,"KLAMATH RIVER AT KENO, OR",ST,42.13319946,-121.9622313,S,NAD83,41,18010206,,12/12/1961,4/11/2019,89
USGS,11510700,"KLAMATH RIVER BLW JOHN C.BOYLE PWRPLNT, NR KENO,OR",ST,42.0845877,-122.0733453,U,NAD83,41,18010206,,9/12/1961,6/12/1963,8
USGS,11523000,KLAMATH R A ORLEANS,ST,41.3034599,-123.5345036,F,NAD83,6,18010209,,10/12/1950,4/16/2019,527
USGS,11530000,TRINITY R A HOOPA CA,ST,41.049852,-123.673668,F,NAD83,6,18010211,,1/5/1907,9/20/2017,599
USGS,11530500,KLAMATH R NR KLAMATH CA,ST,41.5109543,-123.9795164,F,NAD83,6,18010209,,4/11/1951,5/17/2019,1013
USGS,12039500,"QUINAULT RIVER AT QUINAULT LAKE, WA",ST,47.4575863,-123.8893446,S,NAD83,53,17100102,,9/13/1947,3/14/2018,59
USGS,1203951610,"QUINAULT RIVER NEAR TAHOLAH, WA",ST,47.35777778,-124.1844444,S,NAD83,53,17100102,,3/13/2018,10/4/2018,2
USGS,12056500,"NF SKOKOMISH R BL STAIRCASE RPDS NR HOODSPORT, WA",ST,47.51425666,-123.3298868,S,NAD83,53,17110017,,9/20/1973,6/20/2019,271
USGS,12098700,"WHITE RIVER AT HEADWORKS AB FLUME NR BUCKLEY, WA",ST,47.169824,-122.0026114,S,NAD83,53,17110014,,7/6/2010,8/17/2010,4
USGS,12100490,"WHITE RIVER AT R STREET NEAR AUBURN, WA",ST,47.27482295,-122.2078967,S,NAD83,53,17110014,,1/19/1986,1/20/2011,156
USGS,12101100,"LAKE TAPPS DIVERSION AT DIERINGER, WA",ST-CA,47.2381564,-122.2281746,S,NAD83,53,17110014,,7/6/2010,12/7/2010,6
USGS,12101102,"WHITE RIVER AT 24TH ST E AT DIERINGER, WA",ST,47.23555556,-122.236111,S,NAD83,53,17110014,,--,--,0
USGS,12102075,"CLARKS CREEK AT TACOMA ROAD NEAR PUYALLUP, WA",ST,47.19760016,-122.337343,S,NAD83,53,17110014,,8/10/1983,8/8/1984,14
USGS,12113390,"DUWAMISH RIVER AT GOLF COURSE AT TUKWILA, WA",ST,47.4789861,-122.2587333,S,NAD83,53,17110013,,9/20/1995,3/14/2017,304
USGS,12113415,"DUWAMISH R AT E MARGINAL WAY BR AT DUWAMISH, WA",ST,47.50050556,-122.2881417,S,NAD83,53,17110013,,8/2/2016,6/22/2017,263
USGS,12114500,"CEDAR RIVER BELOW BEAR CREEK NEAR CEDAR FALLS, WA",ST,47.34205417,-121.5489858,S,NAD83,53,17110012,,9/25/2018,11/23/2018,2
USGS,12115000,"CEDAR RIVER NEAR CEDAR FALLS, WA",ST,47.3701073,-121.6251009,S,NAD83,53,17110012,,7/30/2018,6/4/2019,3
USGS,12115500,"REX RIVER NEAR CEDAR FALLS, WA",ST,47.35066169,-121.6631582,S,NAD83,53,17110012,,6/3/2019,6/3/2019,1
USGS,12116100,"CANYON CREEK NEAR CEDAR FALLS, WA",ST,47.4195473,-121.7664977,S,NAD83,53,17110012,,9/26/2018,9/26/2018,1
USGS,12116400,"CEDAR RIVER AT POWERPLANT AT CEDAR FALLS, WA",ST,47.41871388,-121.781498,S,NAD83,53,17110012,,10/24/2018,10/24/2018,1
USGS,12116500,"CEDAR RIVER AT CEDAR FALLS, WA",ST,47.41704715,-121.792054,S,NAD83,53,17110012,,8/5/2018,6/5/2019,3
USGS,12117000,"TAYLOR CREEK NEAR SELLECK, WA",ST,47.3864913,-121.8462217,S,NAD83,53,17110012,,8/22/1997,6/5/2019,11
USGS,12117500,"CEDAR RIVER NEAR LANDSBURG, WA",ST,47.3937127,-121.9545585,S,NAD83,53,17110012,,--,--,0
USGS,12117600,"CEDAR RIVER BELOW DIVERSION NEAR LANDSBURG, WA",ST,47.3795458,-121.983448,S,NAD83,53,17110012,,8/1/2018,8/1/2018,1
USGS,12119000,"CEDAR RIVER AT RENTON, WA",ST,47.4825999,-122.2034547,S,NAD83,53,17110012,,10/16/1959,7/12/2018,112
USGS,12137290,"SOUTH FORK SULTAN RIVER NEAR SULTAN, WA",ST,47.94732637,-121.6267826,S,NAD83,53,17110009,,3/5/2019,3/5/2019,1
USGS,12137800,"SULTAN RIVER BELOW DIVERSION DAM NEAR SULTAN, WA",ST,47.95926837,-121.7973447,S,NAD83,53,17110009,,1/16/2018,6/25/2018,2
USGS,12138160,"SULTAN RIVER BELOW POWERPLANT NEAR SULTAN, WA",ST,47.90732356,-121.8153994,S,NAD83,53,17110009,,3/12/2018,4/24/2019,4
USGS,12147470,"NF TOLT RIVER ABOVE YELLOW CREEK NR CARNATION, WA",ST,47.7197222,-121.7431972,S,NAD83,53,17110010,,3/1/2018,3/1/2018,1
USGS,12147500,"NORTH FORK TOLT RIVER NEAR CARNATION, WA",ST,47.71232365,-121.7887272,S,NAD83,53,17110010,,--,--,0
USGS,12147600,"SOUTH FORK TOLT RIVER NEAR INDEX, WA",ST,47.7067714,-121.6001069,S,NAD83,53,17110010,,6/27/2018,4/29/2019,2
USGS,12148000,"SOUTH FORK TOLT RIVER NEAR CARNATION, WA",ST,47.68926929,-121.7134457,S,NAD83,53,17110010,,3/13/2018,4/29/2019,2
USGS,12148300,"SF TOLT RIVER BL REGULATING BASIN NR CARNATION, WA",ST,47.69676817,-121.7873379,S,NAD83,53,17110010,,3/13/2018,3/13/2018,1
USGS,12148500,"TOLT RIVER NEAR CARNATION, WA",ST,47.69565678,-121.8240056,S,NAD83,53,17110010,,7/20/1960,4/30/2019,52
USGS,12170300,"STILLAGUAMISH RIVER NEAR STANWOOD, WA",ST,48.2112101,-122.337374,S,NAD83,53,17110008,,10/12/1976,9/21/2017,137
USGS,12172000,"BIG BEAVER CREEK NEAR NEWHALEM, WA",ST,48.77763,-121.0734549,S,NAD83,53,17110005,,9/19/2018,6/11/2019,2
USGS,12173500,"RUBY CREEK BELOW PANTHER CREEK NEAR NEWHALEM, WA",ST,48.7081863,-120.9773389,S,NAD83,53,17110005,,10/17/2018,10/17/2018,1
USGS,12178000,"SKAGIT RIVER AT NEWHALEM, WA",ST,48.67179229,-121.2462348,S,NAD83,53,17110005,,10/1/1973,3/11/2019,49
USGS,12178100,"NEWHALEM CREEK NEAR NEWHALEM, WA",ST,48.66012536,-121.2476233,S,NAD83,53,17110005,,4/11/2019,4/11/2019,1
USGS,12179900,"BACON CREEK BELOW OAKES CREEK NEAR MARBLEMOUNT, WA",ST,48.6045662,-121.3995727,S,NAD83,53,17110005,,--,--,0
USGS,12181000,"SKAGIT RIVER AT MARBLEMOUNT, WA",ST,48.5337306,-121.4298499,S,NAD83,53,17110005,,7/15/1959,4/10/2019,99
USGS,12182500,"CASCADE RIVER AT MARBLEMOUNT, WA",ST,48.5262307,-121.4154046,S,NAD83,53,17110005,,7/21/1971,7/21/1971,2
USGS,12186000,"SAUK RIVER AB WHITE CHUCK RIVER NR  DARRINGTON, WA",ST,48.16872009,-121.4706723,S,NAD83,53,17110006,,9/21/2011,2/6/2015,144
USGS,12189500,"SAUK RIVER NEAR SAUK, WA",ST,48.42455859,-121.5684634,S,NAD83,53,17110006,,9/21/2011,9/29/2016,625
USGS,12200500,"SKAGIT RIVER NEAR MOUNT VERNON, WA",ST,48.4448278,-122.3354369,S,NAD83,53,17110007,,9/15/1947,2/1/2018,531
USGS,12205000,"NF NOOKSACK RIVER BL CASCADE CREEK NR GLACIER, WA",ST,48.90595739,-121.8443104,S,NAD83,53,17110004,,11/13/2015,2/28/2019,13
USGS,12208000,"MF NOOKSACK RIVER NEAR DEMING, WA",ST,48.7792828,-122.1065434,S,NAD83,53,17110004,,11/17/2015,9/20/2017,29
USGS,12209490,"SKOOKUM CREEK ABOVE DIVERSION NEAR WICKERSHAM, WA",ST,48.6715016,-122.1396,1,NAD83,53,17110004,,7/19/2018,7/19/2018,1
USGS,12210000,"SF NOOKSACK RIVER AT SAXON BRIDGE, WA",ST,48.67761256,-122.1665454,S,NAD83,53,17110004,,1/5/2012,2/5/2019,31
USGS,12210700,"NOOKSACK RIVER AT NORTH CEDARVILLE, WA",ST,48.84178209,-122.2943258,S,NAD83,53,17110004,,7/15/1959,1/30/2019,249
USGS,12210900,"ANDERSON CREEK AT SMITH ROAD NEAR GOSHEN, WA",ST,48.8326141,-122.3390502,S,NAD83,53,17110004,,1/30/2019,1/30/2019,1
USGS,12212050,"FISHTRAP CREEK AT FRONT STREET AT LYNDEN, WA",ST,48.9387257,-122.4790532,S,NAD83,53,17110004,,6/12/2018,5/10/2019,12
USGS,12212390,BERTRAND CREEK AT INTERNATIONAL BOUNDARY,ST,49.002338,-122.5232202,S,NAD83,96,,,4/11/2019,4/11/2019,1
USGS,12212430,"UNNAMED TRIB TO BERTRAND CR NR H ST NR LYNDEN, WA",ST,48.9981716,-122.5012748,5,NAD83,53,17110004,20061218,4/10/2018,2/6/2019,2
USGS,12213100,"NOOKSACK RIVER AT FERNDALE, WA",ST,48.84483249,-122.5893389,S,NAD83,53,17110004,,10/18/1961,10/9/2018,201
USGS,12305000,"KOOTENAI RIVER AT LEONIA, ID",ST,48.6175,-116.0463889,S,NAD83,30,17010104,,10/2/1985,5/17/2019,78
USGS,12309500,KOOTENAI RIVER AT BONNERS FERRY ID,ST,48.69805556,-116.3125,1,NAD83,16,17010104,,4/2/1930,10/20/2009,187
USGS,12323770,Warm Springs Creek at Warm Springs MT,ST,46.180375,-112.7850778,1,NAD83,30,17010201,,9/29/1983,6/4/2019,442
USGS,12324400,Clark Fork ab Little Blackfoot R nr Garrison MT,ST,46.5109111,-112.789686,1,NAD83,30,17010201,,2/19/2009,6/4/2019,135
USGS,12334510,Rock Creek near Clinton MT,ST,46.7223361,-113.683061,1,NAD83,30,17010202,,6/10/1982,8/29/2013,404
USGS,12340000,Blackfoot River near Bonner MT,ST,46.8994111,-113.7563194,1,NAD83,30,17010203,,9/27/1974,6/5/2019,2562
USGS,12344000,Bitterroot River near Darby MT,ST,45.97205,-114.1412333,1,NAD83,30,17010205,,10/13/1955,8/27/2013,327
USGS,12352500,Bitterroot River near Missoula MT,ST,46.83173889,-114.054861,1,NAD83,30,17010205,,7/7/1989,8/29/2013,318
USGS,12353650,"Clark Fork at Superior, MT",ST,47.19631608,-114.890409,U,NAD83,30,17010204,,--,--,0
USGS,12354700,"Clark Fork near Paradise, MT",ST,47.32187569,-114.890966,U,NAD83,30,17010204,,--,--,0
USGS,12355342,"Hallowat Creek abv Kletomus Creek, near Olney, MT",ST,48.61005278,-114.3819278,5,NAD83,30,17010206,20180912,--,--,0
USGS,12355347,"Big Creek below Lookout Creek, near Apgar, MT",ST,48.5976861,-114.2247194,5,NAD83,30,17010206,20180831,--,--,0
USGS,12355500,N F Flathead River nr Columbia Falls MT,ST,48.4957972,-114.1267639,1,NAD83,30,17010206,,5/14/1970,9/9/2013,295
USGS,12363000,Flathead River at Columbia Falls MT,ST,48.3618111,-114.18495,D,NAD83,30,17010208,,1/1/1949,8/17/2017,509
USGS,12388700,Flathead River at Perma MT,ST,47.36679167,-114.585,1,NAD83,30,17010212,,7/27/1971,9/11/2013,263
USGS,12398550,BOUNDARY RESERVOIR AT FOREBAY NR METALINE FALLS,LK,48.98881389,-117.3496903,S,NAD83,53,17010216,,11/20/2018,11/20/2018,1
USGS,12398600,PEND OREILLE RIVER AT INTERNATIONAL BOUNDARY,ST,48.99881409,-117.3535794,S,NAD83,53,17010216,,2/1/1974,11/6/1985,179
USGS,12413370,EF PINE CREEK ABV NABOB CR NEAR PINEHURST ID,ST,47.47666667,-116.2216667,S,NAD83,16,17010302,,8/10/2000,8/16/2000,2
USGS,12426000,"SPOKANE RIVER BELOW NINE MILE DAM AT SPOKANE, WA",ST,47.78044505,-117.5455016,S,NAD83,53,17010307,,11/30/1970,9/25/1973,42
USGS,12438000,"COLUMBIA RIVER AT BRIDGEPORT, WA",ST,48.0065333,-119.6653303,S,NAD83,53,17020005,,--,--,0
USGS,12439000,"OSOYOOS LAKE NEAR OROVILLE, WA",LK,48.9565513,-119.4395108,S,NAD83,53,17020006,,--,--,0
USGS,12439500,"OKANOGAN RIVER AT OROVILLE, WA",ST,48.9307184,-119.4203419,S,NAD83,53,17020006,,12/13/1947,12/6/2018,80
USGS,12442500,"SIMILKAMEEN RIVER NEAR NIGHTHAWK, WA",ST,48.98460109,-119.6184098,S,NAD83,53,17020007,,12/13/1947,4/18/2018,42
USGS,12445000,"OKANOGAN RIVER NEAR TONASKET, WA",ST,48.632375,-119.4617229,S,NAD83,53,17020006,,12/13/1948,8/17/2017,18
USGS,12447200,"OKANOGAN RIVER AT MALOTT, WA",ST,48.2812606,-119.7045047,S,NAD83,53,17020006,,11/17/1966,4/19/2018,285
USGS,12447302,"OKANOGAN RIVER NR WAKEFIELD BR SOUTH OF MALOTT, WA",ST,48.2077222,-119.7122778,S,NAD83,53,17020006,,4/17/2018,12/3/2018,2
USGS,12447390,"ANDREWS CREEK NEAR MAZAMA, WA",ST,48.8229245,-120.1459245,S,NAD83,53,17020008,,12/2/1971,4/11/2019,270
USGS,12450480,"METHOW RIVER NEAR MOUTH NEAR PATEROS, WA",ST,48.05130556,-119.9265556,S,NAD83,53,17020008,,--,--,0
USGS,12450650,"WELLS POWERPLANT HEADWATER NEAR PATEROS, WA",ST,47.9476409,-119.8636742,S,NAD83,53,17020005,,--,--,0
USGS,12462500,"WENATCHEE RIVER AT MONITOR, WA",ST,47.49929148,-120.4245223,S,NAD83,53,17020011,,4/26/2019,4/26/2019,1
USGS,12473503,"SCBID WB 5 WASTEWAY NEAR MOUTH NEAR RINGOLD,WA",ST-DCH,46.5365222,-119.2800694,S,NAD83,53,17020016,20190318,--,--,0
USGS,12509489,"YAKIMA RIVER AT PROSSER, WA",ST,46.2124361,-119.7656833,S,NAD83,53,17030003,,10/18/1973,6/3/2019,64
USGS,12510500,"YAKIMA RIVER AT KIONA, WA",ST,46.25346748,-119.4780794,S,NAD83,53,17030003,,6/5/1947,6/24/2019,1373
USGS,12511800,"YAKIMA RIVER AT VAN GIESEN BR NEAR RICHLAND, WA",ST,46.2970794,-119.3333527,S,NAD83,53,17030003,,10/18/1973,6/3/2019,72
USGS,12514400,"COLUMBIA RIVER BELOW HWY 395 BRIDGE AT PASCO, WA",ST,46.2240236,-119.1163997,S,NAD83,53,17020016,,--,--,0
USGS,13012465,"Leidy Creek at mouth, near Moran, WY",ST,43.7331083,-110.3145611,5,NAD83,56,17040101,20180831,--,--,0
USGS,13012475,"South Fork Spread Cr at mouth, nr Moran, WY",ST,43.7634833,-110.3237861,5,NAD83,56,17040101,20180828,--,--,0
USGS,13013650,"SNAKE RIVER AT MOOSE, WY",ST,43.65405556,-110.7154722,5,NAD83,56,17040101,19950301,10/14/1971,5/6/2006,92
USGS,13016450,"FISH CREEK AT WILSON, WY",ST,43.50076005,-110.8716,S,NAD83,56,17040103,19731001,10/24/1973,5/16/2016,50
USGS,13018300,"CACHE CREEK NEAR JACKSON, WY",ST,43.45215258,-110.7040913,S,NAD83,56,17040103,19620601,7/20/1965,8/23/2011,408
USGS,13018350,"FLAT CREEK BELOW CACHE CREEK, NEAR JACKSON, WY",ST,43.4583611,-110.7970278,1,NAD83,56,17040103,19890401,10/2/1973,6/1/2017,11
USGS,13092747,ROCK CREEK AB HWY 30/93 XING AT TWIN FALLS ID,ST,42.5625,-114.4947222,S,NAD83,16,17040212,,11/2/1979,6/25/2019,476
USGS,13095175,BRIGGS SPRING AT HEAD NEAR BUHL ID,SP,42.67388889,-114.8091667,S,NAD83,16,17040212,,6/13/1949,6/7/2019,135
USGS,13095500,BOX CANYON SPRINGS NR WENDELL ID,SP,42.7075,-114.8102778,S,NAD83,16,17040212,,6/13/1949,6/7/2019,235
USGS,13136550,"WARM SPRINGS CR AT GATES RD NR KETCHUM, ID",ST,43.6830972,-114.4055167,1,NAD83,16,17040219,,--,--,0
USGS,13150430,SILVER CREEK AT SPORTSMAN ACCESS NR PICABO ID,ST,43.3233611,-114.10835,1,NAD83,16,17040221,,10/2/1974,9/4/2014,223
USGS,13154500,SNAKE RIVER AT KING HILL ID,ST,43.0022222,-115.2025,S,NAD83,16,17050101,190905,3/27/1951,6/24/2019,1202
USGS,13176400,"EF OWYHEE RIVER AT CRUTCHER CROSSING, ID",ST,42.26136944,-116.8684417,1,NAD83,16,17050104,,--,--,0
USGS,13192200,SF BOISE RIVER AT NEAL BRIDGE NR ARROWROCK DAM ID,ST,43.55055556,-115.7219444,S,NAD83,16,17050113,,12/27/1977,5/16/1979,2
USGS,13211205,"BOISE RIVER AT CALDWELL, ID",ST,43.67735278,-116.7011306,1,NAD83,16,17050114,20140609,--,--,0
USGS,13211210,"BOISE RIVER ABV INDIAN CREEK AT CALDWELL, ID",ST,43.67776944,-116.7054944,1,NAD83,16,17050114,20140609,--,--,0
USGS,13213000,BOISE RIVER NR PARMA ID,ST,43.78166667,-116.9727778,S,NAD83,16,17050114,,7/31/1969,6/24/2019,1727
USGS,13266000,WEISER RIVER NR WEISER ID,ST,44.27,-116.7722222,1,NAD83,16,17050124,,11/12/1958,6/4/2019,299
USGS,13296000,YANKEE FORK SALMON RIVER NR CLAYTON ID,ST,44.27888889,-114.7338889,S,NAD83,16,17060201,,5/25/1971,5/1/2019,142
USGS,13307000,SALMON RIVER NR SHOUP ID,ST,45.3225,-114.44,S,NAD83,16,17060203,,5/29/1971,11/21/1981,69
USGS,13311000,"EF OF SF SALMON RIVER AT STIBNITE, ID",ST,44.9057222,-115.3295,5,NAD83,16,17060208,,1/25/1983,5/8/2019,162
USGS,13311450,"SUGAR CREEK NR STIBNITE, ID",ST,44.9363611,-115.3372222,5,NAD83,16,17060208,20110912,9/21/2011,5/9/2019,49
USGS,13317000,SALMON RIVER AT WHITE BIRD ID,ST,45.75027778,-116.3238889,F,NAD83,16,17060209,,11/4/1958,5/6/2019,411
USGS,13317660,"SNAKE RIVER BL MCDUFF RAPIDS AT CHINA GARDENS, ID",ST,46.00305556,-116.9169444,S,NAD83,16,17060103,,4/25/2018,6/18/2019,3
USGS,13325000,"EAST FORK WALLOWA RIVER NEAR JOSEPH, OR",ST,45.27209756,-117.2107242,S,NAD83,41,17060105,,--,--,0
USGS,13331500,"MINAM RIVER AT MINAM, OR",ST,45.6198669,-117.7265892,U,NAD83,41,17060105,,1/5/1966,8/17/2011,268
USGS,13334300,"SNAKE RIVER NEAR ANATONE, WA",ST,46.0970994,-116.9776495,S,NAD83,53,17060103,,1/9/1986,6/18/2019,212
USGS,13337099,CLEAR CK AT KOOSKIA NATIONAL FISH HATCHERY,ST,46.13005278,-115.9481306,1,NAD83,16,17060304,,4/7/2016,5/2/2019,32
USGS,13340000,CLEARWATER RIVER AT OROFINO ID,ST,46.4783333,-116.2575,S,NAD83,16,17060306,,3/1/1973,6/20/2018,218
USGS,13340600,NF CLEARWATER RIVER NR CANYON RANGER STATION ID,ST,46.84055556,-115.621111,S,NAD83,16,17060307,,2/28/1973,5/17/1997,228
USGS,13341000,"NORTH FORK CLEARWATER RIVER AT AHSAHKA, ID",ST,46.5043462,-116.3204192,S,NAD83,16,17060308,,6/20/2018,6/20/2018,1
USGS,13341050,CLEARWATER RIVER NR PECK ID,ST,46.50027778,-116.3925,S,NAD83,16,17060306,,3/1/1973,4/17/1996,64
USGS,13342500,CLEARWATER RIVER AT SPALDING ID,ST,46.4483333,-116.8275,S,NAD83,16,17060306,,8/26/1959,5/1/2019,493
USGS,13343000,"CLEARWATER RIVER NEAR LEWISTON, ID",ST,46.43416667,-116.9677778,S,NAD83,16,17060306,,6/20/2018,6/20/2018,1
USGS,13343590,"LOWER GRANITE LK FOREBAY AT LOWER GRANITE DAM, WA",LK,46.65932575,-117.4262934,S,NAD83,53,17060107,,6/19/2018,6/19/2018,1
USGS,13343595,"SNAKE RIVER (RIGHT BANK) BL LOWER GRANITE DAM, WA",ST,46.66606178,-117.4423834,S,NAD83,53,17060107,,--,--,0
USGS,13343855,"LAKE BRYAN FOREBAY AT LITTLE GOOSE DAM, WA",LK,46.58292469,-118.0243924,T,NAD83,53,17060107,,6/14/2018,6/14/2018,1
