#,,,,,,,,,,,,,
#,,,,,,,,,,,,,
# US Geological Survey,,,,,,,,,,,,,
# retrieved: 2019-07-05 19:15:27 EDT,,,,,,,,,,,,,
# URL: https://nwis.waterdata.usgs.gov/nwis/current,,,,,,,,,,,,,
#,,,,,,,,,,,,,
"# The Site File stores location and general information about groundwater,",,,,,,,,,,,,,
"# surface water, and meteorological sites",,,,,,,,,,,,,
# for sites in USA.,,,,,,,,,,,,,
#,,,,,,,,,,,,,
# The following selected fields are included in this output:,,,,,,,,,,,,,
#,,,,,,,,,,,,,
#  agency_cd       -- Agency,,,,,,,,,,,,,
#  site_no         -- Site identification number,,,,,,,,,,,,,
#  station_nm      -- Site name,,,,,,,,,,,,,
#  site_tp_cd      -- Site type,,,,,,,,,,,,,
#  dec_lat_va      -- Decimal latitude,,,,,,,,,,,,,
#  dec_long_va     -- Decimal longitude,,,,,,,,,,,,,
#  coord_acy_cd    -- Latitude-longitude accuracy,,,,,,,,,,,,,
#  dec_coord_datum_cd -- Decimal Latitude-longitude datum,,,,,,,,,,,,,
#  state_cd        -- State code,,,,,,,,,,,,,
#  huc_cd          -- Hydrologic unit code,,,,,,,,,,,,,
#  inventory_dt    -- Date site established or inventoried,,,,,,,,,,,,,
#  qw_begin_date   -- Water-quality data begin date,,,,,,,,,,,,,
#  qw_end_date     -- Water-quality data end date,,,,,,,,,,,,,
#  qw_count_nu     -- Water-quality data count,,,,,,,,,,,,,
#,,,,,,,,,,,,,
#,,,,,,,,,,,,,
# query started 2019-07-05 19:15:27 EDT,,,,,,,,,,,,,
#,,,,,,,,,,,,,
# there are 2079 sites matching the search criteria.,,,,,,,,,,,,,
#,,,,,,,,,,,,,
#,,,,,,,,,,,,,
agency_cd,site_no,station_nm,site_tp_cd,dec_lat_va,dec_long_va,coord_acy_cd,dec_coord_datum_cd,state_cd,huc_cd,inventory_dt,qw_begin_date,qw_end_date,qw_count_nu
5s,15s,50s,7s,16n,16n,1s,10s,2s,16s,8s,10d,10d,8n
USGS,1018035,"Meduxnekeag River at Lowery Rd. nr Houlton, Maine",ST,46.1811111,-67.80388889,S,NAD83,23,1010005,20030409,4/24/2003,10/1/2012,128
USGS,1018900,"West Grand Lake at Grand Lake Stream, Maine",LK,45.1811111,-67.7780556,S,NAD83,23,1050001,20101020,--,--,0
USGS,1019300,"Lewy Lake at Princeton, Maine",LK,45.2256833,-67.57705278,S,NAD83,23,1050001,20101025,--,--,0
USGS,1021050,"St. Croix River at Milltown, Maine",ST,45.17,-67.2966667,5,NAD83,23,1050001,,1/28/1971,11/4/2013,354
USGS,1054200,"Wild River at Gilead, Maine",ST,44.39055556,-70.9797222,S,NAD83,23,1040002,,9/29/1964,6/5/2019,629
USGS,10642505,"SACO RIVER AT RIVER STREET, AT BARTLETT, NH",ST,44.08388889,-71.2855556,S,NAD83,33,1060002,,--,--,0
USGS,1072870,"ISINGLASS R AT ROCHESTER NECK RD, NR DOVER, NH",ST,43.23480487,-70.9564507,S,NAD83,33,1060003,,--,--,0
USGS,1073319,"LAMPREY RIVER AT LANGFORD ROAD, AT RAYMOND, NH",ST,43.04138889,-71.2016667,S,NAD83,33,1060003,,6/21/2016,8/6/2016,18
USGS,1091000,"SOUTH BRANCH PISCATAQUOG RIVER NEAR GOFFSTOWN, NH",ST,43.01480519,-71.64146129,S,NAD83,33,1070002,,3/27/1957,8/10/1978,30
USGS,1093852,"SOUHEGAN RIVER (SITE WLR-1) NEAR MILFORD, NH",ST,42.8425858,-71.7067399,S,NAD83,33,1070002,19950103,--,--,0
USGS,1095220,"STILLWATER RIVER NEAR STERLING, MA",ST,42.41092507,-71.7911829,S,NAD83,25,1070004,,3/19/1973,8/8/2016,121
USGS,1095375,"QUINAPOXET RIVER AT CANADA MILLS NEAR HOLDEN, MA",ST,42.37286967,-71.8281279,S,NAD83,25,1070004,19940331,--,--,0
USGS,1095434,"GATES BROOK NEAR WEST BOYLSTON, MA",ST,42.36453675,-71.775349,S,NAD83,25,1070004,19940330,--,--,0
USGS,1095503,"NASHUA RIVER, WATER STREET BRIDGE, AT CLINTON, MA",ST,42.41944444,-71.6661111,1,NAD83,25,1070004,20110623,--,--,0
USGS,1104370,"STONY BROOK AT VILES STREET, NEAR WESTON, MA",ST,42.38555556,-71.2894444,5,NAD83,25,1090001,20091209,6/20/2011,6/4/2019,40
USGS,1104405,"HOBBS BROOK AT MILL ST NR LINCOLN, MA",ST,42.436484,-71.2695014,S,NAD83,25,1090001,19970222,3/5/1997,6/4/2019,97
USGS,1104410,"CAMBRIDGE RES., UNNAMED TRIB 1, NR LEXINGTON, MA",ST,42.43648406,-71.2642235,S,NAD83,25,1090001,19970222,3/5/1997,6/10/2019,70
USGS,1104415,"CAMBRIDGE RES., UNNAMED TRIB 2, NR LEXINGTON, MA",ST,42.43592855,-71.2600567,S,NAD83,25,1090001,19970222,3/6/1997,6/11/2019,170
USGS,1104420,"CAMBRIDGE RES., UNNAMED TRIB 3, NR LEXINGTON, MA",ST,42.4198177,-71.2575565,S,NAD83,25,1090001,19970222,4/9/1997,6/11/2019,131
USGS,1104425,"HOBBS BRK AT TRAPELO RD AT LINCOLN, MA",LK,42.42166667,-71.2711111,S,NAD83,25,1090001,20170622,--,--,0
USGS,1104430,"HOBBS BK BELOW CAMBRIDGE RES NR KENDALL GREEN, MA",ST,42.3981512,-71.2733903,S,NAD83,25,1090001,19970222,3/6/1997,6/10/2019,98
USGS,1104453,STONY BROOK UNNAMED TRIB 2 NR WESTON STATION,ST,42.37138889,-71.27527778,S,NAD83,25,1090001,20051130,7/18/2006,6/10/2019,40
USGS,1104455,"STONY BROOK, UNNAMED TRIBUTARY 1, NEAR WALTHAM, MA",ST,42.37259606,-71.27033448,S,NAD83,25,1090001,19971004,10/22/1997,6/11/2019,229
USGS,1104460,"STONY BROOK AT RT 20 AT WALTHAM, MA",ST,42.368985,-71.2706123,S,NAD83,25,1090001,19970222,3/7/1997,6/10/2019,94
USGS,1104475,"STONY BROOK RES., UNNAMED TRIB 1, NEAR WESTON, MA",ST,42.3545408,-71.2681121,S,NAD83,25,1090001,19971120,11/6/1997,6/11/2019,141
USGS,1115098,"PEEPTOAD BROOK AT ELMDALE RD NR NORTH SCITUATE, RI",ST,41.8525992,-71.6061754,S,NAD83,44,1090004,19930723,8/12/1994,6/24/2019,117
USGS,1115110,"HUNTINGHOUSE BK AT ELMDALE RD AT N SCITUATE, RI",ST,41.84676589,-71.6117311,S,NAD83,44,1090004,19930719,12/30/1999,6/24/2019,124
USGS,1115114,"RUSH BROOK NEAR ELMDALE RD NEAR NORTH SCITUATE, RI",ST,41.83759929,-71.6120089,S,NAD83,44,1090004,19970702,1/22/2009,6/24/2019,120
USGS,1115120,"UNNAMED TRIB TO SCITUATE RES NR NORTH SCITUATE, RI",ST,41.8314882,-71.6089532,S,NAD83,44,1090004,19931122,1/22/2009,2/6/2019,24
USGS,1115170,"MOSWANSICUT STREAM NR NORTH SCITUATE, RI",ST,41.84093269,-71.584508,S,NAD83,44,1090004,19931122,2/18/2000,6/24/2019,104
USGS,1115183,"QUONAPAUG BK AT RT 116 NR NORTH SCITUATE, RI",ST,41.79759966,-71.5847857,S,NAD83,44,1090004,19930726,12/30/1999,6/24/2019,116
USGS,1115184,"SPRUCE BROOK NR NORTH SCITUATE, RI",ST,41.7887107,-71.6200647,S,NAD83,44,1090004,19930805,3/5/2009,2/5/2019,28
USGS,1115187,"PONAGANSET RIVER AT SOUTH FOSTER, RI",ST,41.8187102,-71.7050677,S,NAD83,44,1090004,19930723,3/21/1994,2/6/2019,44
USGS,1115190,"DOLLY COLE BK AT OLD DANIELSON PK AT S FOSTER, RI",ST,41.8223213,-71.70034528,S,NAD83,44,1090004,19930719,12/30/1999,2/14/2019,34
USGS,1115265,"HEMLOCK BROOK AT KING ROAD NR FOSTER, RI",ST,41.7906548,-71.6986785,S,NAD83,44,1090004,20101020,12/30/1999,2/14/2019,34
USGS,1115275,"BEAR TREE BROOK NR CLAYVILLE, RI",ST,41.7825994,-71.67478879,S,NAD83,44,1090004,19931122,12/30/1999,2/14/2019,33
USGS,1115276,"WESTCONNAUG STREAM AT PLAINFIELD PIKE, RI",ST,41.7853772,-71.6672885,S,NAD83,44,1090004,19931122,1/22/2009,2/14/2019,28
USGS,1115280,"CORK BK AT ROCKLAND SCITUATE RD NR CLAYVILLE, RI",ST,41.80398827,-71.6497879,S,NAD83,44,1090004,19930719,12/30/1999,2/13/2019,34
USGS,1115297,WILBUR HOLLOW BK AT OLD PLAINFIELD PK NR CLAYVILLE,ST,41.7648219,-71.6356207,S,NAD83,44,1090004,19930729,12/30/1999,2/13/2019,33
USGS,1118500,"PAWCATUCK RIVER AT WESTERLY, RI",ST,41.38371065,-71.8331247,S,NAD83,44,1090005,,10/13/1952,6/26/2019,578
USGS,1118502,"PAWCATUCK RIVER SOUTH OF ROUTE 1 AT PAWCATUCK, CT",ES,41.37691667,-71.8323333,S,NAD83,9,1090005,20180628,--,--,0
USGS,1118520,"PAWCATUCK R NR PAWCATUCK,CT.",ES,41.3358333,-71.8394444,S,NAD83,9,1090005,20180628,9/24/1963,9/24/1963,1
USGS,1120790,"NATCHAUG RIVER AT MARCY RD. NEAR CHAPLIN, CT",ST,41.81616944,-72.1061694,H,NAD83,9,1100002,20060914,--,--,0
USGS,1129200,"CONNECTICUT R BELOW INDIAN STREAM NR PITTSBURG, NH",ST,45.04032368,-71.4439704,S,NAD83,33,1080101,,10/30/1956,7/30/1999,105
USGS,1129500,"CONNECTICUT RIVER AT NORTH STRATFORD, NH",ST,44.74977166,-71.63120018,S,NAD83,33,1080101,,10/7/1955,7/29/1999,107
USGS,1154950,"COLD RIVER AT HIGH STREET, AT ALSTEAD, NH",ST,43.14944444,-72.3616667,S,NAD83,33,1080104,,6/23/2016,8/9/2016,18
USGS,1157000,"ASHUELOT RIVER NEAR GILSUM, NH",ST,43.03924586,-72.2700858,S,NAD83,33,1080201,,10/7/1954,9/25/1980,35
USGS,1161280,"CONNECTICUT RIVER NEAR NORTHFIELD, MA",ST,42.6833333,-72.4719444,U,NAD83,25,1080201,20170401,10/22/1974,6/25/2019,172
USGS,1168250,"COLD RIVER AT FLORIDA, MA",ST,42.66669444,-73.0301667,1,NAD83,25,1080203,20141101,--,--,0
USGS,1170100,"GREEN RIVER NEAR COLRAIN, MA",ST,42.70341695,-72.67064738,S,NAD83,25,1080203,20061130,11/29/1967,7/2/2019,437
USGS,1173000,"WARE RIVER AT INTAKE WORKS NEAR BARRE, MA",ST,42.3906461,-72.060355,S,NAD83,25,1080204,20061130,8/31/1956,9/8/1993,36
USGS,1186000,"WEST BRANCH FARMINGTON RIVER AT RIVERTON, CT",ST,41.9628729,-73.017606,U,NAD83,9,1080207,20040202,4/19/1954,9/4/2013,10
USGS,1187300,"HUBBARD RIVER NEAR WEST HARTLAND, CT",ST,42.0375,-72.93932778,H,NAD83,9,1080207,20030306,5/10/1971,8/10/2016,26
USGS,1187800,"NEPAUG R NR NEPAUG, CT.",ST,41.8206529,-72.9701041,U,NAD83,9,1080207,20170601,4/25/1962,9/19/2001,66
USGS,1189995,"FARMINGTON RIVER AT TARIFFVILLE, CT",ST,41.9082833,-72.75935278,H,NAD83,9,1080207,20040204,9/7/1967,7/1/2019,523
USGS,1191000,"NORTH BRANCH PARK RIVER AT HARTFORD, CT",ST,41.78443889,-72.7080556,H,NAD83,9,1080205,20140401,10/25/1955,8/11/1994,53
USGS,1193050,"CONNECTICUT RIVER AT MIDDLE HADDAM, CT",ST-TS,41.5417656,-72.5531454,U,NAD83,9,1080205,,6/27/1956,6/20/2019,1162
USGS,1193500,"SALMON RIVER NEAR EAST HAMPTON, CT",ST,41.55232124,-72.44925287,U,NAD83,9,1080205,19280701,9/17/1953,6/19/2019,903
USGS,1194000,"EIGHTMILE RIVER AT NORTH PLAIN, CT",ST,41.44166944,-72.33267778,H,NAD83,9,1080205,,5/4/1956,8/3/2016,17
USGS,1194500,"EAST BRANCH EIGHTMILE RIVER NEAR NORTH LYME, CT",ST,41.42751667,-72.33477778,H,NAD83,9,1080205,20030107,5/4/1956,9/19/2014,4
USGS,1194750,"CONNECTICUT RIVER AT ESSEX, CT",ES,41.3514833,-72.3843667,H,NAD83,9,1080205,20091214,5/13/2011,6/26/2019,3
USGS,1194796,"CONNECTICUT RIVER AT OLD LYME, CT",ES,41.3125983,-72.3459166,S,NAD83,9,1080205,19980717,6/26/2019,6/26/2019,1
USGS,1302250,EAST CREEK AT SANDS POINT NY,ES,40.8662222,-73.7101944,1,NAD83,36,2030201,,--,--,0
USGS,1302845,FROST CREEK AT SHEEP LN BRIDGE AT LATTINGTOWN NY,ES,40.9051111,-73.5931944,1,NAD83,36,2030201,,--,--,0
USGS,1304200,ORIENT HARBOR AT ORIENT NY,ES,41.13663889,-72.30675,1,NAD83,36,2030202,,--,--,0
USGS,1304562,PECONIC RIVER AT COUNTY HWY 105 AT RIVERHEAD NY,ES,40.91777778,-72.6386667,1,NAD83,36,2030202,,--,--,0
USGS,1306402,GREAT SOUTH BAY AT WEST SAYVILLE NY,ES,40.72105556,-73.09125,1,NAD83,36,2030202,,--,--,0
USGS,1310740,REYNOLDS CHANNEL AT POINT LOOKOUT NY,ES,40.5934366,-73.5837396,S,NAD83,36,2030202,,--,--,0
USGS,1311143,HOG ISLAND CHANNEL AT ISLAND PARK NY,ES,40.6088333,-73.6561111,1,NAD83,36,2030202,,--,--,0
USGS,1311875,ROCKAWAY INLET NEAR FLOYD BENNETT FIELD NY,ES,40.57371636,-73.885136,S,NAD83,36,2030202,,4/18/2015,5/26/2016,94
USGS,1315170,DURGIN BROOK AT BOREAS RIVER NY,ST,43.9398333,-73.9536111,1,NAD83,36,2020001,,12/2/2013,3/15/2019,219
USGS,1342732,MOHAWK RIVER AT ILION NY,ST,43.01975,-75.0284722,1,NAD83,36,2020004,,,,
USGS,135403025,MOHAWK R BLW PEPPER ISLAND AT FORT JOHNSON NY,ST,42.95319444,-74.2381111,1,NAD83,36,2020004,,,,
USGS,1354330,MOHAWK RIVER AT LOCK 8 NEAR SCHENECTADY NY,ST,42.8281583,-73.9903722,H,NAD83,36,2020004,,--,--,0
USGS,1355475,MOHAWK RIVER AT REXFORD NY,ST,42.8511111,-73.88725,1,NAD83,36,2020004,,8/20/1957,4/6/1974,9
USGS,1359139,HUDSON RIVER AT ALBANY NY,ST-TS,42.64788889,-73.7475,1,NAD83,36,2020006,19721001,--,--,0
USGS,1359165,HUDSON RIVER AT PORT OF ALBANY NY,ST-TS,42.61952778,-73.7589167,1,NAD83,36,2020006,,--,--,0
USGS,135980207,HUDSON RIVER NEAR SCHODACK LANDING NY,ST,42.4996111,-73.7768056,1,NAD83,36,2020006,,--,--,0
USGS,1362230,DIVERSION FROM SCHOHARIE RESERVOIR NY,ST-CA,42.11453416,-74.3637599,S,NAD83,36,2020006,,5/25/1977,9/17/2007,50
USGS,1362500,ESOPUS CREEK AT COLDBROOK NY,ST,42.01416667,-74.2705556,S,NAD83,36,2020006,,1/9/1962,4/15/2019,226
USGS,1365100,CANNONSVILLE RES DIV CHANNEL NR GRAHAMSVILLE NY,ST,41.8521111,-74.51302778,1,NAD83,36,2020007,,--,--,0
USGS,1365550,CHESTNUT CREEK AT MOUTH AT GRAHAMSVILLE NY,ST,41.8490833,-74.5318333,1,NAD83,36,2020007,,--,--,0
USGS,1372043,HUDSON RIVER NEAR POUGHKEEPSIE NY,ES,41.72176015,-73.94069299,S,NAD83,36,2020008,,4/14/1969,6/25/2019,1078
USGS,1372058,HUDSON RIVER BELOW POUGHKEEPSIE NY,ES,41.65175,-73.9437222,1,NAD83,36,2020008,,8/19/1969,6/5/2019,323
USGS,1374019,HUDSON RIVER AT SOUTH DOCK AT WEST POINT NY,ES,41.3862049,-73.95513879,S,NAD83,36,2020008,19890301,--,--,0
USGS,1376269,HUDSON RIVER AT PIERMONT NY,ES,41.04319444,-73.8960556,1,NAD83,36,2030101,,2/26/1969,4/30/1975,71
USGS,1376307,HUDSON RIVER AT WATER GRANT STREET AT YONKERS NY,ST,40.93625,-73.9043056,1,NAD83,36,2030101,,,,
USGS,1376515,HUDSON RIVER AT PIER 84 AT NEW YORK NY,ST,40.76463889,-74.0031944,1,NAD83,36,2030101,,,,
USGS,1379530,Canoe Brook near Summit NJ,ST,40.74444444,-74.3536111,S,NAD83,34,2030103,20060415,1/31/1952,9/16/1998,64
USGS,1381800,Whippany River near Pine Brook NJ,ST,40.845,-74.3472222,S,NAD83,34,2030103,20031003,6/25/1963,6/6/2019,387
USGS,1382210,Pequannock River at Oak Ridge NJ,ST,41.0397222,-74.5016667,S,NAD83,34,2030103,20090220,--,--,0
USGS,1387940,Ramapo River at Lakeside Ave at Pompton Lakes NJ,ST,41.0072222,-74.2744444,S,NAD83,34,2030103,20070518,--,--,0
USGS,1387998,Ramapo River above dam at Pompton Lakes NJ,LK,40.99277778,-74.27888889,S,NAD83,34,2030103,20080325,--,--,0
USGS,1388000,Ramapo River at Pompton Lakes NJ,ST,40.99194444,-74.28,1,NAD83,34,2030103,20010824,11/9/1923,9/1/2011,231
USGS,1388100,Ramapo River at Dawes Highway at Pompton NJ,ST,40.98555556,-74.2794444,S,NAD83,34,2030103,20070518,4/16/1998,9/23/1998,4
USGS,1389005,Passaic River below Pompton Riv at Two Bridges NJ,ST,40.89638889,-74.2691667,S,NAD83,34,2030103,19870531,6/9/1987,6/17/1999,136
USGS,1389765,Molly Ann Brook at North Haledon NJ,ST,40.95305556,-74.1847222,S,NAD83,34,2030103,19751212,--,--,0
USGS,1392650,"Passaic River at PVSC at Newark, NJ",ES,40.7133333,-74.1230556,S,NAD83,34,2030103,20041213,--,--,0
USGS,1393890,East Branch Rahway River at Maplewood NJ,ST,40.7347222,-74.2705556,S,NAD83,34,2030104,20010313,--,--,0
USGS,1393895,East Br Rahway Riv at Millburn Ave at Millburn NJ,ST,40.72277778,-74.285,S,NAD83,34,2030104,20020218,--,--,0
USGS,1394000,West Branch Rahway River at Millburn NJ,ST,40.73166667,-74.3075,S,NAD83,34,2030104,20000214,6/12/2001,6/12/2001,1
USGS,1394620,Rahway River at Kenilworth NJ,ST,40.67305556,-74.3130556,S,NAD83,34,2030104,20040413,--,--,0
USGS,1396000,Robinsons Branch at Rahway NJ,ST,40.6058333,-74.2997222,S,NAD83,34,2030104,20070224,7/31/1959,8/24/1988,128
USGS,1396060,Arthur Kill at Perth Amboy NJ,ES,40.50388889,-74.2622222,S,NAD83,34,2030104,,--,--,0
USGS,1396790,Spruce Run Reservoir at Clinton NJ,LK,40.6436111,-74.9236111,S,NAD83,34,2030105,20090115,5/20/1964,6/1/2011,21
USGS,1400500,Raritan River at Manville NJ,ST,40.55555556,-74.58277778,S,NAD83,34,2030105,20060211,8/12/1923,8/31/2011,353
USGS,1401750,Millstone River at Griggstown NJ,ST,40.44,-74.6175,S,NAD83,34,2030105,20001204,--,--,0
USGS,1407081,"Raritan Bay at Keansburg, NJ",ES,40.44916667,-74.1475,S,NAD83,34,2030104,20000207,--,--,0
USGS,1407600,"Shrewsbury River at Sea Bright, NJ",ES,40.36555556,-73.9747222,S,NAD83,34,2030104,20001004,--,--,0
USGS,1408000,Manasquan River at Squankum NJ,ST,40.16138889,-74.1547222,S,NAD83,34,2040301,20010824,7/15/1959,5/21/2019,477
USGS,1408029,Manasquan River near Allenwood NJ,ST,40.14666667,-74.1222222,S,NAD83,34,2040301,20050331,7/23/2012,7/23/2012,2
USGS,1408048,"Watson Creek at Manasquan, NJ",ES,40.11166667,-74.0447222,S,NAD83,34,2040301,20130525,--,--,0
USGS,1408753,Barnegat Bay Trib at Bayview Av nr Ocean Gate NJ,ES,39.924,-74.1135833,1,NAD83,34,2040301,,,,
USGS,1409124,"Barnegat Bay near Waretown, NJ",ES,39.77,-74.1883333,S,NAD83,34,2040301,,,,
USGS,1409125,"Barnegat Bay at Barnegat Light, NJ",ES,39.7608333,-74.1105556,S,NAD83,34,2040301,20010824,9/5/2013,9/5/2013,18
USGS,1409146,"East Thorofare at Ship Bottom, NJ",ES,39.65416667,-74.1858333,S,NAD83,34,2040301,20001004,--,--,0
USGS,1409280,Westecunk Creek at Stafford Forge NJ,ST,39.66666667,-74.32027778,S,NAD83,34,2040301,19731001,11/14/1973,11/19/1979,17
USGS,1409335,"Little Egg Inlet near Tuckerton, NJ",ES,39.50888889,-74.3247222,S,NAD83,34,2040301,20001004,--,--,0
USGS,1410500,Absecon Creek at Absecon NJ,ST,39.43027778,-74.5205556,S,NAD83,34,2040302,20070829,11/27/1923,11/15/1979,55
USGS,1410510,"Absecon Creek at Absecon, NJ",ES,39.42305556,-74.5,S,NAD83,34,2040302,20001004,--,--,0
USGS,1410600,"Absecon Channel at Atlantic City, NJ",ES,39.37777778,-74.4236111,S,NAD83,34,2040302,20001004,--,--,0
USGS,1411320,"Great Egg Harbor Bay at Ocean City, NJ",ES,39.2858333,-74.5755556,S,NAD83,34,2040302,,--,--,0
USGS,1411330,"Beach Thorofare at Margate, NJ",ES,39.3375,-74.5130556,S,NAD83,34,2040302,20010824,--,--,0
USGS,1411350,"Ludlum Thorofare at Sea Isle City, NJ",ES,39.15777778,-74.69777778,S,NAD83,34,2040302,20010824,--,--,0
USGS,1411360,"Great Channel at Stone Harbor, NJ",ES,39.05694444,-74.765,S,NAD83,34,2040302,20010319,--,--,0
USGS,1411390,"Cape May Harbor at Cape May, NJ",ES,38.9483333,-74.88888889,S,NAD83,34,2040302,20010824,--,--,0
USGS,1411435,"Sluice Creek at South Dennis, NJ",ES,39.16166667,-74.8322222,S,NAD83,34,2040206,20010824,--,--,0
USGS,1412150,"Maurice River at Bivalve, NJ",ES,39.2325,-75.03277778,S,NAD83,34,2040206,20010824,7/26/1989,7/26/1989,8
USGS,1413038,"Cohansey River at Greenwich, NJ",ES,39.3836111,-75.35027778,S,NAD83,34,2040206,20010824,--,--,0
USGS,1413500,EAST BRANCH DELAWARE RIVER AT MARGARETVILLE NY,ST,42.1447222,-74.6536111,S,NAD83,36,2040102,,7/14/1959,3/27/1987,34
USGS,1417500,EAST BRANCH DELAWARE RIVER AT HARVARD NY,ST,42.0245833,-75.11927778,1,NAD83,36,2040102,,7/14/1959,9/16/2013,3
USGS,1419500,WILLOWEMOC CREEK NR LIVINGSTON MANOR NY,ST,41.9033333,-74.81277778,S,NAD83,36,2040102,,1/14/1960,4/10/1967,5
USGS,1420500,BEAVER KILL AT COOKS FALLS NY,ST,41.94641667,-74.9796667,1,NAD83,36,2040102,,4/6/1954,9/16/2013,134
USGS,1421000,EAST BRANCH DELAWARE RIVER AT FISHS EDDY NY,ST,41.97355556,-75.1751944,1,NAD83,36,2040102,,4/6/1954,10/10/2007,167
USGS,1423000,WEST BRANCH DELAWARE RIVER AT WALTON NY,ST,42.1661111,-75.14002778,1,NAD83,36,2040101,,7/14/1959,3/12/2008,45
USGS,1425000,WEST BRANCH DELAWARE RIVER AT STILESVILLE NY,ST,42.07491667,-75.3958056,1,NAD83,36,2040101,,7/14/1959,9/1/1999,32
USGS,1426500,WEST BRANCH DELAWARE RIVER AT HALE EDDY NY,ST,42.00302778,-75.38352778,1,NAD83,36,2040101,,4/7/1954,10/10/2007,167
USGS,1427000,WEST BRANCH DELAWARE RIVER AT HANCOCK NY,ST,41.95216667,-75.2909444,1,NAD83,36,2040101,,10/1/1950,11/30/1987,33
USGS,1427195,"Equinunk Creek near Dillontown, PA",ST,41.84027778,-75.2383333,S,NAD83,42,2040101,20180918,--,--,0
USGS,1427207,DELAWARE RIVER AT LORDVILLE NY,ST,41.86727778,-75.21375,1,NAD83,42,2040101,,6/24/1969,7/10/2007,6
USGS,1427500,CALLICOON CREEK AT CALLICOON NY,ST,41.76055556,-75.04838889,1,NAD83,36,2040101,,4/6/1954,10/10/2007,75
USGS,1427510,DELAWARE RIVER AT CALLICOON NY,ST,41.75675,-75.0574167,1,NAD83,42,2040101,,10/5/2005,8/27/2014,68
USGS,1428000,TENMILE RIVER AT TUSTEN NY,ST,41.56388889,-75.0144444,S,NAD83,36,2040101,,7/14/1959,8/19/1971,7
USGS,1428500,DELAWARE R ABOVE LACKAWAXEN R NEAR BARRYVILLE NY,ST,41.50875,-74.9860556,1,NAD83,36,2040101,,4/6/1954,10/10/2007,75
USGS,1428750,"West Branch Lackawaxen River near Aldenville, PA",ST,41.67452998,-75.37601299,S,NAD83,42,2040103,,10/15/1986,5/12/2014,103
USGS,1429000,"West Branch Lackawaxen River at Prompton, PA",ST,41.58730898,-75.3268449,S,NAD83,42,2040103,,10/22/1963,6/13/2018,69
USGS,1431500,"Lackawaxen River at Hawley, PA",ST,41.4762002,-75.1721186,S,NAD83,42,2040103,,11/21/1958,8/10/2016,102
USGS,1432110,"Lackawaxen River at Rowland, PA",ST,41.4759228,-75.036281,U,NAD83,42,2040104,19890906,10/15/2012,6/13/2018,35
USGS,1432160,DELAWARE RIVER AT BARRYVILLE NY,ST,41.47536824,-74.91238898,S,NAD83,42,2040104,,--,--,0
USGS,1432495,"Shohola Creek near Walker Lake, PA",ST,41.45,-74.9216667,S,NAD83,42,2040104,20180918,--,--,0
USGS,1432805,DELAWARE RIVER AT POND EDDY NY,ST,41.4389808,-74.8193318,S,NAD83,42,2040104,,10/13/2005,7/10/2007,5
USGS,1433500,MONGAUP RIVER NEAR MONGAUP NY,ST,41.4612222,-74.75877778,1,NAD83,36,2040104,,4/6/1954,10/10/2007,45
USGS,1434000,DELAWARE RIVER AT PORT JERVIS NY,ST,41.37055556,-74.6975,S,NAD83,42,2040104,,9/30/1950,10/10/2007,325
USGS,1435000,NEVERSINK RIVER NEAR CLARYVILLE NY,ST,41.89,-74.59,S,NAD83,36,2040104,,4/6/1954,7/1/2019,1398
USGS,1436690,NEVERSINK RIVER AT BRIDGEVILLE NY,ST,41.63805556,-74.61688889,S,NAD83,36,2040104,,4/6/2000,8/25/2014,15
USGS,1437500,NEVERSINK RIVER AT GODEFFROY NY,ST,41.4411111,-74.6019444,S,NAD83,36,2040104,,4/6/1954,4/24/2001,62
USGS,1446500,Delaware River at Belvidere NJ,ST,40.82638889,-75.0825,S,NAD83,34,2040105,20030125,8/7/1959,3/10/1980,39
USGS,1447500,"Lehigh River at Stoddartsville, PA",ST,41.1303626,-75.625467,S,NAD83,42,2040106,194310,8/18/1926,3/25/2019,144
USGS,1447720,"Tobyhanna Creek near Blakeslee, PA",ST,41.0848082,-75.6054666,S,NAD83,42,2040106,,9/22/1930,3/25/2019,127
USGS,1447800,Lehigh R bl Francis E Walter Res nr White Haven PA,ST,41.1048062,-75.7321362,S,NAD83,42,2040106,195710,10/23/1963,6/26/2014,25
USGS,1449360,"Pohopoco Creek at Kresgeville, PA",ST,40.8975919,-75.5024077,S,NAD83,42,2040106,196610,6/29/2004,5/2/2018,45
USGS,1449800,"Pohopoco Cr bl Beltzville Dam nr Parryville, PA",ST,40.84564756,-75.6457437,S,NAD83,42,2040106,196710,6/28/2004,4/23/2018,45
USGS,1454700,"Lehigh River at Glendon, PA",ST,40.6692656,-75.23628808,S,NAD83,42,2040106,196610,11/11/1956,3/21/2019,249
USGS,1455290,Pohatcong Crk at Creek Rd nr Carpentersville NJ,ST,40.6354722,-75.16863889,1,NAD83,34,2040105,,--,--,0
USGS,1457500,Delaware River at Riegelsville NJ,ST,40.5947222,-75.1897222,S,NAD83,34,2040105,20010823,8/14/1934,6/4/2009,336
USGS,1458500,Delaware River at Frenchtown NJ,ST,40.5261111,-75.065,S,NAD83,34,2040105,20070815,7/20/1976,5/25/1982,35
USGS,1460378,D&R Ca feeder US of gate at Washington Crossing NJ,ST,40.29638889,-74.8666667,S,NAD83,34,2040105,,--,--,0
USGS,1460380,Del and Rar Ca feeder at Washington Crossing NJ,ST-CA,40.29666667,-74.8669444,S,NAD83,34,2040105,20020225,--,--,0
USGS,1460595,Del & Rar Canal at Landing La at New Brunswick NJ,ST-CA,40.50777778,-74.4641667,S,NAD83,34,2030105,20021024,3/31/1998,5/9/2019,21
USGS,1462000,Delaware River at Lambertville NJ,ST,40.3647222,-74.94888889,S,NAD83,34,2040105,20060410,5/27/1976,6/2/1982,42
USGS,1463500,Delaware River at Trenton NJ,ST,40.22166667,-74.7780556,S,NAD83,34,2040105,191302,10/1/1944,6/20/2019,1718
USGS,1464040,Delaware River at Marine Terminal at Trenton NJ,ES,40.18916667,-74.7558333,S,NAD83,34,2040201,20080102,--,--,0
USGS,1465500,"Neshaminy Creek near Langhorne, PA",ST,40.1739982,-74.9568342,S,NAD83,42,2040201,,10/23/1959,3/19/2019,272
USGS,1465798,"Poquessing Creek at Grant Ave. at Philadelphia, PA",ST,40.05705567,-74.9851694,S,NAD83,42,2040202,196507,6/5/1912,10/1/1973,52
USGS,1466500,McDonalds Branch in Byrne State Forest NJ,ST,39.885,-74.50527778,S,NAD83,34,2040202,20020202,3/12/1958,6/19/2019,939
USGS,14670261,"Delaware River nr Pennypack Woods, PA",ST,40.0385,-74.9936111,H,NAD83,42,2040202,20110216,--,--,0
USGS,1467042,"Pennypack Creek at Pine Road, at Philadelphia, PA",ST,40.08983289,-75.0690611,S,NAD83,42,2040202,196408,10/30/1967,10/1/1973,58
USGS,1467048,"Pennypack Cr at Lower Rhawn St Bdg, Phila., PA",ST,40.05011137,-75.0326713,S,NAD83,42,2040202,196506,10/30/1967,10/1/1973,58
USGS,1467086,"Tacony Creek ab Adams Avenue, Philadelphia, PA",ST,40.04650038,-75.11073008,S,NAD83,42,2040203,196510,11/9/1967,10/1/1973,61
USGS,1467087,"Frankford Creek at Castor Ave, Philadelphia, PA",ST,40.0159454,-75.0968411,S,NAD83,42,2040202,,9/24/1925,8/24/1976,13
USGS,1467200,Delaware R at Ben Franklin Bridge at Philadelphia,ST,39.95400165,-75.1373987,S,NAD83,42,2040202,194908,10/10/1956,6/19/2019,1038
USGS,1470779,"Tulpehocken Creek near Bernville, PA",ST,40.4134258,-76.1716128,S,NAD83,42,2040203,19741122,8/20/1998,5/9/2018,207
USGS,1470960,Tulpehocken Cr at Blue Marsh Damsite near Reading,ST,40.3706482,-76.0252159,S,NAD83,42,2040203,196505,6/14/1972,5/9/2018,339
USGS,1471875,"Manatawny Creek near Spangsville, PA",ST,40.339538,-75.7421359,S,NAD83,42,2040203,19931001,--,--,0
USGS,1472157,"French Creek near Phoenixville, PA",ST,40.15149064,-75.601305,S,NAD83,42,2040203,19681001,2/12/1969,6/10/2019,361
USGS,1473000,"Perkiomen Creek at Graterford, PA",ST,40.22954725,-75.451567,S,NAD83,42,2040203,191406,10/15/1957,8/31/1999,213
USGS,1473169,Valley Creek at PA Turnpike Br near Valley Forge,ST,40.07927367,-75.46074808,S,NAD83,42,2040203,,8/22/1984,10/23/2018,1515
USGS,1473500,"Schuylkill River at Norristown, PA",ST,40.11121934,-75.3468502,S,NAD83,42,2040203,1927,12/18/1978,4/2/2015,11
USGS,1473900,"Wissahickon Creek at Fort Washington, PA",ST,40.1239987,-75.2198992,S,NAD83,42,2040203,1961,4/10/1962,3/19/2019,160
USGS,1474000,"Wissahickon Creek at Mouth, Philadelphia, PA",ST,40.01539,-75.2068459,S,NAD83,42,2040203,189706,10/23/1959,3/13/2019,234
USGS,1474500,"Schuylkill River at Philadelphia, PA",ST,39.9678905,-75.1885123,S,NAD83,42,2040203,19310901,10/31/1925,9/2/2004,1051
USGS,1474703,"Delaware River at Fort Mifflin at Philadelphia, PA",ST,39.8792798,-75.20268029,S,NAD83,42,2040202,,8/26/1997,5/12/1999,250
USGS,1475510,"Darby Creek near Darby, PA",ST,39.92900154,-75.2724064,S,NAD83,42,2040202,19640201,10/10/1967,9/11/2000,36
USGS,1475530,"Cobbs Cr at U.S. Hghwy No. 1 at Philadelphia, PA",ST,39.97483455,-75.2799067,S,NAD83,42,2040202,19641001,10/19/1964,10/3/1973,481
USGS,1475548,"Cobbs Creek at Mt. Moriah Cemetery, Philadelphia",ST,39.9327861,-75.2376361,H,NAD83,42,2040202,20050831,--,--,0
USGS,1477050,"Delaware River at Chester, PA",ST,39.84555556,-75.3508333,S,NAD83,42,2040202,19900815,12/12/1966,6/3/2019,744
USGS,1478000,"CHRISTINA RIVER AT COOCHS BRIDGE, DE",ST,39.63738889,-75.72788889,S,NAD83,10,2040205,,2/11/1974,6/20/2002,172
USGS,1478650,"WHITE CLAY CREEK AT NEWARK, DE",ST,39.6892222,-75.74875,S,NAD83,10,2040205,,5/11/1999,9/14/1999,2
USGS,1479000,"WHITE CLAY CREEK NEAR NEWARK, DE",ST,39.6992222,-75.67502778,S,NAD83,10,2040205,,10/19/1963,10/8/1998,180
