#,,,,,,,,,,,,,
USGS,2198980,"SAVANNAH RIVER AT FORT PULASKI, GA",ST-TS,32.0341019,-80.9031665,S,NAD83,13,3060109,,3/7/1960,3/8/1960,3
USGS,2201000,"WILLIAMSON SWAMP CREEK AT DAVISBORO, GA",ST,32.97570924,-82.609854,S,NAD83,13,3060201,,9/18/1990,6/3/1998,38
USGS,22035975,"HUDSON CREEK AT MERIDIAN LANDING, NEAR MERIDIAN,GA",ST,31.45333333,-81.3627778,S,NAD83,13,3060204,,--,--,0
USGS,2203603,"SOUTH RIVER AT SPRINGDALE ROAD, AT ATLANTA, GA",ST,33.68388889,-84.4152778,S,NAD83,13,3070103,,8/27/2003,12/20/2017,413
USGS,2203655,"SOUTH RIVER AT FORREST PARK ROAD, AT ATLANTA, GA",ST,33.67899706,-84.3579807,S,NAD83,13,3070103,,1/14/2001,12/20/2017,1009
USGS,2203700,"INTRENCHMENT CR AT CONSTITUTION RD, NR ATLANTA, GA",ST,33.6889966,-84.3304798,U,NAD83,13,3070103,,3/10/1999,6/18/2019,826
USGS,2203831,"DOOLITTLE CREEK AT FLAT SHOALS RD, NR DECATUR, GA",ST,33.70566259,-84.29242299,S,NAD83,13,3070103,,7/7/1999,6/18/2019,202
USGS,2203863,"SHOAL CREEK AT COLUMBIA DRIVE NEAR ATLANTA, GA",ST,33.69319444,-84.25388889,S,NAD83,13,3070103,,2/7/2012,6/18/2019,208
USGS,2203873,"COBBS CREEK AT RAINBOW DR, NEAR DECATUR, GA",ST,33.7095512,-84.2393655,S,NAD83,13,3070103,,3/10/1999,6/18/2019,157
USGS,2203900,"SOUTH RIVER AT FLAKES MILL ROAD NR ATLANTA, GA",ST,33.66621924,-84.2246426,U,NAD83,13,3070103,,8/20/1970,6/18/2019,194
USGS,2203950,"SNAPFINGER CREEK NEAR DECATUR, GA",ST,33.7634389,-84.2201982,U,NAD83,13,3070103,,2/7/2012,6/18/2019,180
USGS,2203960,"SNAPFINGER CR AT THOMPSON MILL RD NR LITHONIA, GA",ST,33.69666667,-84.1986111,S,NAD83,13,3070103,,10/23/2012,6/18/2019,160
USGS,2204037,"POLE BRIDGE CR AT EVANS MILL RD NEAR LITHONIA, GA",ST,33.6684422,-84.1510287,S,NAD83,13,3070103,,10/23/2012,6/18/2019,190
USGS,2205865,"SWEETWATER CREEK AT CLUB DRIVE NEAR LILBURN, GA",ST,33.9411111,-84.1077778,S,NAD83,13,3070103,,3/10/2010,6/7/2019,82
USGS,2207120,"YELLOW RIVER AT GA 124, NEAR LITHONIA, GA",ST,33.7722222,-84.0577778,S,NAD83,13,3070103,,3/14/1996,6/8/2019,496
USGS,2207135,"LITTLE STONE MTN CR NEAR STONE MOUNTAIN, GA",ST,33.83066058,-84.1393612,S,NAD83,13,3070103,,3/11/1999,6/18/2019,154
USGS,2207160,"STONE MOUNTAIN CREEK AT GA 124, NEAR LITHONIA, GA",ST,33.7734405,-84.077137,U,NAD83,13,3070103,20130619,9/10/2013,6/18/2019,138
USGS,2207185,"NO BUSINESS CREEK AT LEE ROAD, BELOW SNELLVILLE,GA",ST,33.7775,-84.0377778,S,NAD83,13,3070103,,3/11/1999,4/19/2019,399
USGS,2207385,"BIG HAYNES CREEK AT LENORA ROAD, NR SNELLVILLE, GA",ST,33.81527778,-83.99,S,NAD83,13,3070103,,3/12/1996,4/19/2019,484
USGS,2207400,"BRUSHY FORK CREEK AT BEAVER ROAD, NR LOGANVILLE,GA",ST,33.82138889,-83.9425,S,NAD83,13,3070103,,3/12/1996,4/19/2019,416
USGS,2208150,"ALCOVY RIVER AT NEW HOPE ROAD, NEAR GRAYSON, GA",ST,33.91694444,-83.8880556,S,NAD83,13,3070103,,10/15/1996,6/8/2019,392
USGS,2208450,"ALCOVY RIVER ABOVE COVINGTON, GA",ST,33.64011554,-83.7790674,S,NAD83,13,3070103,,1/11/1972,7/8/1976,69
USGS,2208493,"CORNISH CREEK AT HAZELBRAND RD NR COVINGTON, GA",ST,33.6285,-83.7988611,S,NAD83,13,3070103,,--,--,0
USGS,2212600,"FALLING CREEK NEAR JULIETTE, GA",ST,33.0998535,-83.7235104,S,NAD83,13,3070103,,7/22/1964,6/11/2014,486
USGS,2215000,"OCMULGEE RIVER AT US 341, AT HAWKINSVILLE, GA",ST,32.28071817,-83.4610055,U,NAD83,13,3070104,,12/6/1957,6/11/2019,367
USGS,2215500,"OCMULGEE RIVER AT LUMBER CITY, GA",ST,31.9201826,-82.6740274,5,NAD83,13,3070104,,11/10/1937,6/10/2019,1084
USGS,2217274,"WHEELER CREEK AT BILL CHEEK ROAD, NEAR AUBURN, GA",ST,34.0822222,-83.8544444,S,NAD83,13,3070101,,7/25/2001,6/8/2019,382
USGS,2217643,"PARKS CREEK AT LYLE FIELD RD NR JEFFERSON, GA",ST,34.1620583,-83.5250944,S,NAD83,13,3070101,,--,--,0
USGS,2218565,"APALACHEE RIVER AT FENCE ROAD, NEAR DACULA, GA",ST,34.01027778,-83.8941667,S,NAD83,13,3070101,,7/25/2001,4/19/2019,375
USGS,2219000,"APALACHEE RIVER NEAR BOSTWICK, GA",ST,33.78817637,-83.4740513,S,NAD83,13,3070101,,11/6/1977,3/31/2000,57
USGS,2225000,"ALTAMAHA RIVER NEAR BAXLEY, GA",ST,31.9390829,-82.3534601,S,NAD83,13,3070106,,12/6/1957,8/29/2000,294
USGS,2226000,"ALTAMAHA RIVER AT DOCTORTOWN, GA",ST,31.6546586,-81.827892,S,NAD83,13,3070106,,5/1/1937,9/23/1992,423
USGS,2226500,"SATILLA RIVER NEAR WAYCROSS, GA",ST,31.2382737,-82.3245711,S,NAD83,13,3070201,,5/1/1937,8/9/1974,248
USGS,2228070,"SATILLA RIVER AT US 17, AT WOODBINE, GA",ST-TS,30.97467607,-81.725662,U,NAD83,13,3070201,,2/11/1998,8/26/1999,25
USGS,2232400,"ST. JOHNS RIVER NEAR COCOA, FL",ST,28.36972837,-80.8725578,S,NAD83,12,3080101,,10/1/1953,5/15/2006,766
USGS,2234000,"ST. JOHNS RIVER ABOVE LAKE HARNEY NEAR GENEVA, FL",ST,28.7141611,-81.0353374,S,NAD83,12,3080101,,5/7/1943,10/7/1986,314
USGS,2244040,"ST. JOHNS R AT BUFFALO BLUFF NEAR SATSUMA, FL",ST,29.5963582,-81.683138,S,NAD83,12,3080103,,--,--,0
USGS,2245290,ST JOHNS RIVER AT RACY PT NEAR HASTINGS FL,ST,29.8,-81.55,S,NAD83,12,3080103,,--,--,0
USGS,2245340,"ST JOHNS R BLW SHANDS BRIDGE NR GRN COVE SPRG, FL",ST,30.0059222,-81.6151361,S,NAD83,12,3080103,20170530,--,--,0
USGS,22462002,"DURBIN CREEK NEAR FRUIT COVE, FL",ST,30.11916667,-81.54638889,5,NAD83,12,3080103,,--,--,0
USGS,2246459,"CEDAR RIVER AT SAN JUAN AVENUE AT JACKSONVILLE, FL",ST,30.28218375,-81.7403761,S,NAD83,12,3080103,,--,--,0
USGS,2246500,"ST. JOHNS RIVER AT JACKSONVILLE, FL",ST,30.3224616,-81.6653735,S,NAD83,12,3080103,,6/8/1962,10/4/1994,288
USGS,2246518,"POTTSBURG CRK AT US90 NR S. JACKSONVILLE, FL",ST,30.28696944,-81.57,5,NAD83,12,3080103,,--,--,0
USGS,2246751,"BROWARD RIVER BL BISCAYNE BLVD NR JACKSONVILLE, FL",ST,30.44333889,-81.6682,5,NAD83,12,3080103,,--,--,0
USGS,2246804,"DUNN CREEK AT DUNN CREEK RD NR EASTPORT, FL",ST,30.45494167,-81.59688889,5,NAD83,12,3080103,20151001,--,--,0
USGS,2264000,"CYPRESS CREEK AT VINELAND, FL",ST,28.39056323,-81.5195173,S,NAD83,12,3090101,,7/24/1963,9/12/2018,173
USGS,2264100,"BONNET CREEK NEAR VINELAND, FL",ST,28.32528785,-81.5206284,S,NAD83,12,3090101,,5/23/1961,12/7/2009,229
USGS,2266200,"WHITTENHORSE CREEK NEAR VINELAND, FL",ST,28.38500749,-81.6164632,S,NAD83,12,3090101,,5/1/1968,12/7/2009,135
USGS,2266300,"REEDY CREEK NEAR VINELAND, FL",ST,28.33278738,-81.579796,S,NAD83,12,3090101,,5/23/1961,12/7/2009,281
USGS,2266495,"REEDY CREEK AT S-40, NEAR LOUGHMAN, FL",ST,28.27584517,-81.5439622,S,NAD83,12,3090101,,--,--,0
USGS,2276998,ST LUCIE CANAL ABV S-80 NR STUART FL,ST-CA,27.10866667,-80.28725,U,NAD83,12,3090202,,10/17/2017,7/1/2019,14
USGS,2277100,"ST LUCIE RIVER AT SPEEDY POINT, STUART FL",ST,27.20227,-80.2586592,S,NAD83,12,3090202,,6/3/1999,5/4/2000,90
USGS,2277110,ST LUCIE ESTUARY AT A1A (STEELE PT)STUART FL,ES,27.19977036,-80.206713,S,NAD83,12,3090202,,9/11/1969,8/22/2018,123
USGS,2286328,"C-8 CANAL AT NE 135 ST AT NORTH MIAMI, FL",ST-CA,25.9002222,-80.1949722,U,NAD83,12,3090202,,5/22/2019,5/22/2019,1
USGS,22907085,"BLACK CREEK CANAL WEST OF U.S. 1 NR  GOULDS, FL",ST,25.57091667,-80.37875,S,NAD83,12,3090202,,7/24/2017,5/23/2019,260
USGS,2290709,10B BLACK CR CANAL AT OLD CUTLER RD NR GOU,ST-CA,25.5598611,-80.3595556,U,NAD83,12,3090202,,5/23/2019,5/23/2019,1
USGS,22908295,"BOTTLE CREEK AT ROOKERY BRANCH NEAR HOMESTEAD, FL",ST,25.46797778,-80.8545278,U,NAD83,12,3090202,,--,--,0
USGS,2290928,"BARRON RIVER AT EVERGLADES CITY, FL",ST,25.8697222,-81.3825,S,NAD83,12,3090204,,--,--,0
USGS,2290930,"TURNER RIVER NR CHOKOLOSKEE ISLAND, FL",ST,25.8286111,-81.3416667,S,NAD83,12,3090204,,--,--,0
USGS,2292900,"CALOOSAHATCHEE RIVER AT S-79, NR.OLGA, FLA",ST,26.72173487,-81.69313699,S,NAD83,12,3090205,,3/31/1953,7/1/2019,639
USGS,2297345,PEACE RIVER AT PLATT FL,ST,27.08666667,-81.9994444,M,NAD83,12,3100101,,1/6/2010,10/7/2011,27
USGS,2297350,PEACE RIVER NR PEACE RIVER HEIGHTS NR FT. OGDEN FL,ST,27.07755529,-82.00730919,S,NAD83,12,3100101,19971106,11/20/1997,10/6/2011,371
USGS,2298202,SHELL CREEK NEAR PUNTA GORDA FL,ST,26.98478094,-81.9356414,F,NAD83,12,3100101,,4/28/1966,10/13/2011,203
USGS,2299260,WARM MINERAL SPRINGS NEAR WOODMERE FL,SP,27.06033333,-82.2606667,S,NAD83,12,3100102,,10/1/1942,9/18/1998,23
USGS,2299727,SHAKETT CREEK NEAR NOKOMIS FL,ST,27.14394246,-82.4300958,S,NAD83,12,3100201,,10/5/2005,10/4/2011,136
USGS,2299730,DONNA BAY AT HIGHWAY 41 AT NOKOMIS FL,ES,27.11850278,-82.451425,1,NAD83,12,3100201,,--,--,0
USGS,2299734,CURRY CREEK AT HIGHWAY 41 AT NOKOMIS FL,ST,27.11271944,-82.4474111,H,NAD83,12,3100201,,--,--,0
USGS,2299735,VENICE INLET AT CROW'S NEST MARINA AT VENICE FL,ES,27.1122222,-82.4655556,S,NAD83,12,3100201,,10/6/2005,10/4/2011,144
USGS,23000095,MANATEE RIVER AT RYE FL,ST,27.51364999,-82.3670375,S,NAD83,12,3100202,20000807,10/4/2006,10/7/2011,81
USGS,2301500,ALAFIA RIVER AT LITHIA FL,ST,27.872248,-82.2112008,F,NAD83,12,3100204,,9/26/1956,9/9/2004,664
USGS,2301638,ALAFIA RIVER AT BELL SHOALS NEAR RIVERVIEW FL,ST,27.85891477,-82.2737021,S,NAD83,12,3100204,,8/23/1951,10/12/2011,91
USGS,2301718,ALAFIA RIVER AT RIVERVIEW FL,ST,27.86780308,-82.3198141,S,NAD83,12,3100204,,9/9/1933,10/13/2011,150
USGS,2301721,ALAFIA RIVER AT GIBSONTON FL,ST,27.85974739,-82.3842598,F,NAD83,12,3100204,,9/18/1990,10/14/2011,519
USGS,2304000,HILLSBOROUGH R AT FOWLER AV NEAR TEMPLE TERRACE FL,ST,28.05446224,-82.3637032,F,NAD83,12,3100205,,4/13/1961,10/4/2011,287
USGS,2304510,HILLSBOROUGH RIVER AT ROWLETT PK DR NEAR TAMPA FL,ST,28.02113015,-82.4345385,F,NAD83,12,3100205,,5/13/1966,10/4/2011,415
USGS,2304517,HILLSBOROUGH R BL HANNAHS WHIRL NR SULPHUR SPGS FL,ST,28.0151611,-82.4424056,1,NAD83,12,3100205,,--,--,0
USGS,2306000,SULPHUR SPRINGS AT SULPHUR SPRINGS FL,SP,28.02113004,-82.451761,F,NAD83,12,3100205,,2/24/1917,10/3/2011,445
USGS,23060003,SULPHUR SPRINGS RUN AT SULPHUR SPRINGS FL,SP,28.02113003,-82.45231658,5,NAD83,12,3100205,,10/12/2005,10/3/2011,50
USGS,23060013,HILLSBOROUGH R. AT I-275 BRIDGE AT SULPHUR SPGS FL,ST,28.0202967,-82.4548166,5,NAD83,12,3100205,,6/29/2011,10/3/2011,4
USGS,2306028,HILLSBOROUGH RIVER AT PLATT STREET AT TAMPA FL,ST,27.94196627,-82.4587057,F,NAD83,12,3100205,,8/18/1981,10/5/2011,1458
USGS,2310308,PITHLACHASCOTEE R AT MAIN ST AT NEW PORT RICHEY FL,ST,28.2502877,-82.7226006,S,NAD83,12,3100207,20050414,8/2/2005,10/14/2011,31
USGS,2310650,CHASSAHOWITZKA RIVER NEAR HOMOSASSA FL,ST,28.71526419,-82.5767656,F,NAD83,12,3100207,,10/9/1930,6/7/2019,240
USGS,2310663,CHASSAHOWITZKA RIVER NEAR CHASSAHOWITZKA FL,ES,28.71526404,-82.6062107,F,NAD83,12,3100207,19871015,11/9/2005,10/6/2011,33
USGS,2310673,CHASSAHOWITZKA R AT DOG ISL NR CHASSAHOWITZKA FL,ST,28.70263889,-82.6247222,S,NAD83,12,3100207,200508,9/19/2005,10/6/2011,80
USGS,2310674,CHASSAHOWITZKA R AT MOUTH NR CHASSAHOWITZKA FL,ST,28.69470935,-82.6389891,S,NAD83,12,3100207,200508,2/2/2006,10/6/2011,80
USGS,2310678,HOMOSASSA SPRINGS AT HOMOSASSA SPRINGS FL,SP,28.79970509,-82.58871089,F,NAD83,12,3100207,,10/9/1930,6/4/2019,184
USGS,2310688,SE FORK HOMOSASSA SPRING AT HOMOSASSA SPRINGS FL,SP,28.79748294,-82.589822,F,NAD83,12,3100207,,5/19/1966,10/5/2011,162
USGS,2310689,HALLS RIVER AT HOMOSASSA SPRINGS FL,ST-TS,28.8131111,-82.60563889,5,NAD83,12,3100207,,--,--,0
USGS,2310690,HALLS RIVER NEAR HOMOSASSA FL,ST,28.80137159,-82.6026,F,NAD83,12,3100207,,3/27/1964,10/13/2009,58
USGS,2310700,HOMOSASSA R AT HOMOSASSA FL,ST,28.78526096,-82.6178779,F,NAD83,12,3100207,,3/4/1964,10/5/2011,122
USGS,2310712,HOMOSASSA RIVER AT SHELL ISLAND NEAR HOMOSASSA FL,ES,28.7716498,-82.695657,F,NAD83,12,3100207,19840326,10/13/2006,10/7/2009,72
USGS,2310740,SARAGASSA CANAL AT CRYSTAL RIVER FL,ST-CA,28.890535,-82.5956566,F,NAD83,12,3100207,,3/25/1964,8/3/1965,4
USGS,2310742,CRYSTAL RIVER AT MOUTH OF KINGS BAY FL,ST,28.8933611,-82.6055556,S,NAD83,12,3100207,,12/18/2006,2/3/2016,69
USGS,2310743,HUNTER SPR RUN AT BEACH LANE AT CRYSTAL RIVER FL,ES,28.89470155,-82.5931566,F,NAD83,12,3100207,19861002,10/9/1930,6/6/2019,97
USGS,2310747,CRYSTAL RIVER AT BAGLEY COVE NEAR CRYSTAL RIVER FL,ES,28.90638889,-82.62388889,R,NAD83,12,3100207,20020813,10/3/2006,10/3/2011,31
USGS,2310752,SALT RIVER NEAR CRYSTAL RIVER FL,ST,28.90155556,-82.6458056,S,NAD83,12,3100207,,10/13/2006,10/3/2011,78
USGS,2313272,WITHLACOOCHEE R AT CHAMBERS IS NEAR YANKEETOWN FL,ST,29.00110935,-82.7657876,H,NAD83,12,3100207,20050127,9/28/2005,10/4/2011,86
USGS,2314500,"SUWANNEE RIVER AT US 441, AT FARGO, GA",ST,30.68055556,-82.5605556,S,NAD83,13,3110201,,4/21/1937,6/13/2019,1283
USGS,2315550,SUWANNEE RIVER AT SUWANNEE SPRINGS FLA,ST,30.3929988,-82.9331875,S,NAD83,12,3110201,,4/25/1956,8/16/1988,127
USGS,2315626,"ALAPAHA RISE ABOVE SW 68TH DRIVE NEAR JASPER, FL",ST,30.43944444,-83.0892778,5,NAD83,12,3110201,20120926,6/17/2015,10/5/2016,14
USGS,2317500,"ALAPAHA RIVER AT STATENVILLE, GA",ST,30.7041006,-83.0331955,5,NAD83,13,3110202,,11/11/1937,5/26/1999,703
USGS,2317620,ALAPAHA RIVER NEAR JENNINGS FLA,ST,30.59826888,-83.073195,S,NAD83,12,3110202,,--,--,0
USGS,2317797,"LITTLE RIVER AT UPPER TY TY ROAD, NEAR TIFTON, GA",ST,31.48185048,-83.5840559,U,NAD83,13,3110204,,12/15/1976,8/26/2010,171
USGS,2318500,"WITHLACOOCHEE RIVER AT US 84, NEAR QUITMAN, GA",ST,30.79305556,-83.4536111,S,NAD83,13,3110203,,4/22/1937,9/27/2012,443
USGS,2319000,"WITHLACOOCHEE RIVER NEAR PINETTA, FLA.",ST,30.59548716,-83.2595906,S,NAD83,12,3110203,,8/5/1957,8/16/1988,219
USGS,2319302,"MADISON BLUE SPRING NR BLUE SPRINGS, FL",SP,30.48049106,-83.2443097,F,NAD83,12,3110203,,4/24/1956,4/8/2019,43
USGS,2319394,"WITHLACOOCHEE RIVER NR LEE, FLA",ST,30.41049435,-83.18013979,S,NAD83,12,3110203,20001018,--,--,0
USGS,2319520,"FALMOUTH SPRING AT FALMOUTH, FL",SP,30.36132999,-83.1351374,F,NAD83,12,3110205,19970728,11/15/1973,6/4/2019,23
USGS,2319800,"SUWANNEE RIVER AT DOWLING PARK, FLORIDA",ST,30.2449425,-83.24958439,S,NAD83,12,3110205,19550504,--,--,0
USGS,2319950,"BLUE SPRINGS NEAR DELL,FL",SP,30.126055,-83.2259712,S,NAD83,12,3110205,,11/21/1973,4/9/2019,37
USGS,2320250,TROY SPRING NEAR BRANFORD FLA,SP,30.0060603,-82.997352,F,NAD83,12,3110205,19970728,11/22/1960,4/30/2019,37
USGS,2320500,"SUWANNEE RIVER AT BRANFORD, FLA.",ST,29.955785,-82.9276278,S,NAD83,12,3110205,,1/8/1954,4/24/1997,512
USGS,2321500,"SANTA FE RIVER AT WORTHINGTON SPRINGS, FLA.",ST,29.9219073,-82.4262246,S,NAD83,12,3110206,,10/11/1951,10/8/1996,383
USGS,2321958,"SANTA FE RIVER AT RIVER RISE NR HIGH SPRINGS, FL",ST,29.8735723,-82.59122849,S,NAD83,12,3110206,20151013,--,--,0
USGS,2322400,GINNIE SPRING NR HIGH SPRINGS FLA,SP,29.8360705,-82.7001197,S,NAD83,12,3110206,,9/17/1974,6/5/2019,9
USGS,2322500,"SANTA FE RIVER NEAR FORT WHITE, FLA.",ST,29.84884769,-82.7151204,S,NAD83,12,3110206,,4/27/1956,9/13/2004,272
USGS,2322688,"BLUE HOLE SPRING NR HILDRETH, FL",SP,29.9799552,-82.758457,S,NAD83,12,3110206,,5/25/2005,6/6/2019,40
USGS,2322700,"ICHETUCKNEE R @ HWY27 NR HILDRETH, FL",ST,29.95273288,-82.7859573,F,NAD83,12,3110206,19970728,2/18/1917,6/3/2019,427
USGS,2322800,SANTA FE RIVER NR HILDRETH FLA,ST,29.91162076,-82.8604033,S,NAD83,12,3110206,19560427,5/18/1967,8/10/2016,39
USGS,2323502,FANNING SPRINGS NR WILCOX FLA,SP,29.5891247,-82.9331797,S,NAD83,12,3110205,,4/27/1956,4/3/2019,35
USGS,2323566,MANATEE SPRING NR CHIEFLAND FLA,SP,29.4896808,-82.976791,S,NAD83,12,3110205,,4/27/1956,4/9/2019,44
USGS,2326526,WACISSA RIVER NR WACISSA FLA,ST,30.3013159,-83.9796085,S,NAD83,12,3110103,,6/4/1971,6/25/2019,81
USGS,2327000,"WAKULLA SPRING NR CRAWFORDVILLE, FL",SP,30.23492447,-84.30128689,S,NAD83,12,3120001,,2/1/1907,6/27/2019,327
USGS,2327031,"SPRING CREEK NEAR SPRING CREEK, FL",ST,30.07270485,-84.3273972,1,NAD83,12,3120001,20070621,--,--,0
USGS,2327100,"SOPCHOPPY RIVER NR SOPCHOPPY, FLA.",ST,30.12936856,-84.4943482,S,NAD83,12,3120003,,4/28/1964,6/24/2019,446
USGS,2330450,"CHATTAHOOCHEE RIVER AT HELEN, GA",ST,34.7008333,-83.72888889,S,NAD83,13,3130001,,--,--,0
USGS,2333500,"CHESTATEE RIVER NEAR DAHLONEGA, GA",ST,34.52805556,-83.9397222,S,NAD83,13,3130001,,6/10/1941,12/12/2000,545
USGS,2334430,"CHATTAHOOCHEE RIVER AT BUFORD DAM, NEAR BUFORD, GA",ST,34.15694444,-84.07888889,5,NAD83,13,3130001,,9/4/1973,10/13/2015,7
USGS,2334480,"RICHLAND CREEK AT SUWANEE DAM ROAD, NEAR BUFORD,GA",ST,34.1325,-84.07,S,NAD83,13,3130001,,8/16/1976,4/19/2019,401
USGS,2334578,"LEVEL CREEK AT SUWANEE DAM ROAD, NEAR SUWANEE, GA",ST,34.09638889,-84.0780556,S,NAD83,13,3130001,,7/25/2001,6/8/2019,398
USGS,2334652,CHATTAHOOCHEE R 0.96 MI US MCGINNIS FY SUWANEE GA,ST,34.0588333,-84.1106944,S,NAD83,13,3130001,,--,--,0
USGS,2334653,CHATTAHOOCHEE R 0.76 MI US MCGINNIS FY SUWANEE GA,ST,34.05630556,-84.1090833,S,NAD83,13,3130001,,--,--,0
USGS,2334654,"CHATTAHOOCHEE R 0.5 MI US MCGINNIS FY SUWANEE, GA",ST,34.05388889,-84.1052778,S,NAD83,13,3130001,20151216,--,--,0
USGS,2334885,"SUWANEE CREEK AT SUWANEE, GA",ST,34.0325,-84.08888889,S,NAD83,13,3130001,,8/16/1976,6/7/2019,477
USGS,2335000,"CHATTAHOOCHEE RIVER NEAR NORCROSS, GA",ST,33.9972222,-84.2019444,S,NAD83,13,3130001,,8/22/1941,6/27/2019,2136
USGS,2335350,"CROOKED CREEK NEAR NORCROSS, GA",ST,33.965,-84.2647222,S,NAD83,13,3130001,,8/16/1976,6/7/2019,422
USGS,2335400,"CHATTAHOOCHEE R 0.39 MI DS GA140, ALPHARETTA, GA",ST,33.97305556,-84.26888889,S,NAD83,13,3130001,20171107,--,--,0
USGS,2335405,"CHATTAHOOCHEE R 0.47 MI DS GA140, ALPHARETTA, GA",ST,33.9733333,-84.27,S,NAD83,13,3130001,20171107,--,--,0
USGS,2335450,"CHATTAHOOCHEE RIVER ABOVE ROSWELL, GA",ST,33.98593369,-84.3160356,S,NAD83,13,3130001,,8/11/2015,10/13/2015,4
USGS,2335700,"BIG CREEK NEAR ALPHARETTA, GA",ST,34.05055556,-84.2694444,S,NAD83,13,3130001,,5/6/1960,7/24/1995,185
USGS,2335777,"CHATTAHOOCHEE R 0.27 MI US WILLEO CR, ROSWELL, GA",ST,33.99666667,-84.3844444,S,NAD83,13,3130001,20171107,--,--,0
USGS,2335778,"CHATTAHOOCHEE R 0.25 MI US WILLEO CR, ROSWELL, GA",ST,33.99638889,-84.3844444,S,NAD83,13,3130001,20171107,--,--,0
USGS,2335779,"CHATTAHOOCHEE R .18 MI US WILLEO CR, ROSWELL, GA",ST,33.99527778,-84.3844444,S,NAD83,13,3130001,20171107,--,--,0
USGS,2335815,"CHATTAHOOCHEE RIVER BELOW MORGAN FALLS DAM, GA",ST,33.96805556,-84.3827778,S,NAD83,13,3130001,,--,--,0
USGS,2335870,"SOPE CREEK NEAR MARIETTA, GA",ST,33.95388889,-84.4433333,S,NAD83,13,3130001,,9/1/1976,7/1/2019,707
USGS,2335880,"CHATT R AT POWERS FY & I-285 NR ATLANTA, GA",ST,33.9023251,-84.4415959,U,NAD83,13,3130001,,5/5/2016,6/27/2019,139
USGS,2336000,"CHATTAHOOCHEE RIVER AT ATLANTA, GA",ST,33.85916667,-84.4544444,S,NAD83,13,3130001,,5/1/1937,6/27/2019,2554
USGS,2336030,"N.F. PEACHTREE CREEK AT GRAVES RD, NR DORAVILLE,GA",ST,33.9058333,-84.225,S,NAD83,13,3130001,,8/19/1976,6/7/2019,387
USGS,2336120,"N.F. PEACHTREE CREEK, BUFORD HWY, NEAR ATLANTA, GA",ST,33.83149307,-84.342703,S,NAD83,13,3130001,,2/18/1976,6/18/2019,945
USGS,2336152,"SOUTH FORK PEACHTREE AT CASA DR, NR CLARKSTON, GA",ST,33.81044444,-84.2479722,S,NAD83,13,3130001,,2/7/2012,6/18/2019,210
USGS,23362095,"BURNT FORK CR AT MILLWOOD WAY NEAR CLARKSTON, GA",ST,33.82138889,-84.2747222,S,NAD83,13,3130001,,10/23/2012,6/18/2019,161
USGS,2336240,"S.F. PEACHTREE CREEK JOHNSON RD, NEAR ATLANTA, GA",ST,33.80288264,-84.3407585,U,NAD83,13,3130001,,8/11/2003,6/18/2019,825
USGS,2336300,"PEACHTREE CREEK AT ATLANTA, GA",ST,33.82030556,-84.40763889,S,NAD83,13,3130001,,7/31/1959,3/26/2019,1611
USGS,2336313,"WOODALL CREEK AT DEFOORS FERRY RD, AT ATLANTA, GA",ST,33.8217716,-84.4388178,U,NAD83,13,3130001,,2/18/1976,11/28/2017,636
USGS,2336340,"NANCY CREEK AT JOHNSON FERRY RD, AT CHAMBLEE, GA",ST,33.89788036,-84.345481,U,NAD83,13,3130001,,8/19/1976,6/18/2019,159
USGS,2336360,"NANCY CREEK AT RICKENBACKER DRIVE, AT ATLANTA, GA",ST,33.86916667,-84.37888889,S,NAD83,13,3130001,,8/19/1976,11/28/2017,850
USGS,2336410,"NANCY CREEK AT WEST WESLEY ROAD, AT ATLANTA, GA",ST,33.83843787,-84.4393734,U,NAD83,13,3130001,,8/19/1976,11/29/2016,753
USGS,2336526,"PROCTOR CREEK AT JACKSON PARKWAY, AT ATLANTA, GA",ST,33.79427255,-84.4743747,U,NAD83,13,3130002,,5/15/1976,3/26/2019,907
USGS,2336728,"UTOY CREEK AT GREAT SOUTHWEST PKWY NR ATLANTA, GA",ST,33.74344087,-84.5682657,U,NAD83,13,3130002,,6/22/1993,11/15/2010,596
USGS,2337000,"SWEETWATER CREEK NEAR AUSTELL, GA",ST,33.77660678,-84.6155445,S,NAD83,13,3130002,,3/25/1937,4/15/1999,545
USGS,2337170,"CHATTAHOOCHEE RIVER NEAR FAIRBURN, GA",ST,33.65666667,-84.6736111,S,NAD83,13,3130002,,7/25/1965,11/9/2009,708
USGS,2337410,"DOG RIVER AT GA 5, NEAR FAIRPLAY, GA",ST,33.65380556,-84.8210278,S,NAD83,13,3130002,,8/7/2007,6/8/2019,745
USGS,2337498,"SNAKE CRK DS SNAKE CRK RESERVIOR NR WHITESBURG, GA",ST,33.5272222,-84.93638889,S,NAD83,13,3130002,20080219,--,--,0
USGS,2338500,"CHATTAHOOCHEE RIVER AT GA 100, AT FRANKLIN, GA",ST,33.27928486,-85.0999417,S,NAD83,13,3130002,,2/17/1958,6/11/2019,939
USGS,2338523,"HILLABAHATCHEE CREEK AT THAXTON RD, NR FRANKLIN,GA",ST,33.3406717,-85.2268901,S,NAD83,13,3130002,,5/30/2001,7/2/2019,175
USGS,23432415,"CHATTAHOOCHEE R .36 MI DS WFG DAM NR FT GAINES, GA",ST,31.62138889,-85.06,S,NAD83,1,3130004,,--,--,0
USGS,2343805,"CHATTAHOOCHEE RIVER AT MILE 46 NEAR COLUMBIA, ALA",ST,31.2490663,-85.1065964,S,NAD83,13,3130004,,--,--,0
USGS,2344280,"CAMP CREEK AT HELMER ROAD, NEAR FAYETTEVILLE, GA",ST,33.5258333,-84.43388889,S,NAD83,13,3130005,20140804,--,--,0
USGS,2344630,"LINE CREEK BLW LAKE MCINTOSH, NR PEACHTREE CITY,GA",ST,33.35761729,-84.5824289,S,NAD83,13,3130005,20080512,--,--,0
USGS,2344655,"FLAT CR DS OF LAKE KEDRON, NR PEACHTREE CITY, GA",ST,33.42166667,-84.5783333,S,NAD83,13,3130005,20140804,8/5/2014,6/25/2019,105
USGS,2344673,"FLAT CREEK (DS OF LAKE) AT PEACHTREE CITY, GA",ST,33.38317219,-84.5727066,U,NAD83,13,3130005,,8/5/2014,6/25/2019,79
USGS,2350600,"KINCHAFOONEE CREEK AT PRESTON, GA",ST,32.0525,-84.5483333,S,NAD83,13,3130007,,5/4/1954,7/21/2011,302
USGS,2350900,"KINCHAFOONEE CREEK AT PINEWOOD ROAD, NR DAWSON, GA",ST,31.76444444,-84.2533333,S,NAD83,13,3130007,,8/25/1992,7/21/2011,40
USGS,2353000,"FLINT RIVER AT NEWTON, GA",ST,31.30694444,-84.33888889,S,NAD83,13,3130008,,8/27/1956,6/12/2019,1472
USGS,2356000,"FLINT RIVER AT BAINBRIDGE, GA",ST,30.91157714,-84.5799144,S,NAD83,13,3130008,,12/9/1937,6/12/2019,643
USGS,2357150,"SPRING CREEK NEAR REYNOLDSVILLE, GA",ST,30.90407668,-84.7490864,S,NAD83,13,3130010,,7/21/2009,7/21/2009,1
USGS,2358000,APALACHICOLA RIVER AT CHATTAHOOCHEE FLA,ST,30.7010251,-84.8590871,S,NAD83,12,3130011,,10/29/1924,7/20/2011,2670
USGS,2358795,"JACKSON BLUE SPRING NR MARIANNA, FL",SP,30.79046943,-85.1407611,S,NAD83,12,3130012,,12/6/1960,6/18/2019,22
USGS,2359170,"APALACHICOLA RIVER NR SUMATRA,FLA.",ST,29.94937094,-85.0154686,S,NAD83,12,3130011,,3/1/1979,6/13/2019,1964
USGS,2382500,"COOSAWATTEE RIVER AT CARTERS, GA",ST,34.60369697,-84.6954905,S,NAD83,13,3150102,,3/31/1937,10/13/2005,124
USGS,2385800,"HOLLY CREEK NEAR CHATSWORTH, GA",ST,34.71666667,-84.77,S,NAD83,13,3150101,,7/16/1960,9/14/1984,270
USGS,2388975,"ETOWAH RIVER AT GA 136, NEAR LANDDRUM, GA",ST,34.40898469,-84.0196318,S,NAD83,13,3150104,20071024,--,--,0
USGS,2388985,"RUSSELL CRK 0.3 MI DS HEAD LAKE NR DAWSONVILLE, GA",ST,34.3986111,-84.0566667,S,NAD83,13,3150104,20180607,--,--,0
USGS,2389150,"ETOWAH RIVER AT GA 9, NEAR DAWSONVILLE, GA",ST,34.35805556,-84.1133333,S,NAD83,13,3150104,,--,--,0
USGS,2392000,"ETOWAH RIVER AT CANTON, GA",ST,34.23992866,-84.4946733,S,NAD83,13,3150104,,4/1/1937,6/19/2019,1193
USGS,2394000,"ETOWAH RIVER AT ALLATOONA DAM, ABV CARTERSVILLE,GA",ST,34.16315298,-84.7410474,S,NAD83,13,3150104,,8/11/1938,10/12/2005,318
USGS,2394682,"RICHLAND CREEK AT OLD DALLAS RD, NEAR DALLAS, GA",ST,34.0789722,-84.8544444,S,NAD83,13,3150104,20160126,1/25/2016,3/6/2019,10
USGS,2394820,"EUHARLEE CREEK AT US 278, AT ROCKMART, GA",ST,33.99871169,-85.0524468,S,NAD83,13,3150104,,--,--,0
USGS,2397000,"COOSA RIVER (MAYO'S BAR) NEAR ROME, GA",ST,34.20037286,-85.2566196,S,NAD83,13,3150105,,3/30/1937,10/13/2005,587
USGS,2397530,"COOSA RIVER AT STATE LINE, AL/GA",ST,34.20176124,-85.447458,S,NAD83,1,3150105,,8/21/1974,6/17/2019,855
USGS,2400100,TERRAPIN CREEK AT ELLISVILLE AL,ST,34.06509836,-85.6141287,U,NAD83,1,3150105,,10/26/1962,5/19/2014,176
USGS,2405500,KELLY CREEK NEAR VINCENT AL,ST,33.44760728,-86.386924,S,NAD83,1,3150106,,10/4/1962,10/6/2004,189
USGS,2407514,"YELLOWLEAF CREEK NEAR WESTOVER, ALA.",ST,33.32066689,-86.4952592,S,NAD83,1,3150107,20041102,--,--,0
USGS,2412000,"TALLAPOOSA RIVER NEAR HEFLIN, ALA.",ST,33.622885,-85.5132894,U,NAD83,1,3150108,,10/3/1962,5/19/2014,408
USGS,2413300,LITTLE TALLAPOOSA RIVER NEAR NEWELL AL,ST,33.43733498,-85.399118,U,NAD83,1,3150108,,4/7/1968,7/11/2005,190
USGS,2414500,TALLAPOOSA RIVER AT WADLEY AL,ST,33.11678684,-85.5607875,U,NAD83,1,3150109,,5/17/1965,7/30/2004,262
USGS,2414715,"TALLAPOOSA RIVER NR NEW SITE, AL.(HORSESHOE BEND)",ST,32.97734526,-85.7396808,U,NAD83,1,3150109,,12/9/1986,7/10/1996,18
USGS,2419890,TALLAPOOSA RIVER NEAR MONT.-MONT. WATER WORKS,ST,32.43985898,-86.1955222,U,NAD83,1,3150110,,11/22/1965,12/21/2009,70
USGS,2423130,"CAHABA RIVER AT TRUSSVILLE, AL.",ST,33.62232504,-86.599431,U,NAD83,1,3150202,,2/20/1967,8/9/2005,85
USGS,2423160,CAHABA RIVER NEAR WHITES CHAPEL AL,ST,33.60371416,-86.5491517,U,NAD83,1,3150202,,--,--,0
USGS,2423380,CAHABA RIVER NEAR MOUNTAIN BROOK AL,ST,33.4817724,-86.7127653,S,NAD83,1,3150202,,6/13/1985,8/24/2005,102
USGS,2423397,"LITTLE CAHABA RIVER BELOW LEEDS, AL.",ST,33.53454886,-86.5624847,S,NAD83,1,3150202,,10/4/1995,8/10/2005,90
USGS,2423496,"CAHABA RIVER NEAR HOOVER, AL",ST,33.3692767,-86.7841551,U,NAD83,1,3150202,,10/17/1988,6/14/2011,66
USGS,242354650,CABAHA VALLEY CR AT INDIAN TRAIL RD NR INDIAN SPRS,ST,33.3449441,-86.7594183,1,NAD83,1,3150202,20180131,5/15/2000,5/10/2001,5
USGS,2423555,CAHABA RIVER NEAR HELENA AL,ST,33.28455786,-86.8824901,U,NAD83,1,3150202,,6/24/1964,8/25/2005,88
USGS,2423571,SHADES CREEK AT ELDER ST NEAR SPRINGDALE AL,ST,33.52093809,-86.7169325,U,NAD83,1,3150202,20170929,--,--,0
USGS,2423586,"SHADES CREEK NR HOMEWOOD, ALA",ST,33.4487185,-86.8136007,U,NAD83,1,3150202,,9/27/2001,9/6/2005,35
USGS,2423647,CAHABA RIVER NEAR WEST BLOCTON AL,ST,33.09817509,-87.054716,U,NAD83,1,3150202,,1/8/1976,8/12/1983,69
USGS,2450250,SIPSEY FORK NEAR GRAYSON AL,ST,34.28537757,-87.3989084,U,NAD83,1,3160110,,12/8/1965,5/20/2014,524
USGS,2453500,MULBERRY FORK AT CORDOVA AL,ST,33.75760677,-87.1702791,U,NAD83,1,3160109,,--,--,0
USGS,2455980,TURKEY CREEK AT SEWAGE PLANT NEAR PINSON AL,ST,33.71121273,-86.6961013,U,NAD83,1,3160111,,10/4/1988,8/8/2005,68
